class_name,tags
FINANCIAL STATEMENT ANALYSIS,"FINANCE, STATISTICS, ANALYSIS, FEE, COST, PURCHASE"
FINANCIAL ACCOUNTING,"FINANCE, STATISTICS, ANALYSIS, FEE, COST, PURCHASE, ACCOUNTING, REPORT, SHEETS, EXCEL, MONEY"
MANAGERIAL ACCOUNTING,"MANAGEMENT, FINANCE, STATISTICS, ANALYSIS, FEE, COST, PURCHASE, SHEETS, BALANCE, MONEY"
INTERMEDIATE ACCOUNTING I,"FINANCE, STATISTICS, ANALYSIS, FEE, COST, PURCHASE, SHEETS, BALANCE"
INTERMEDIATE ACCOUNTING II,"FINANCE, STATISTICS, ANALYSIS, FEE, COST, PURCHASE, SHEETS, BALANCE, MONEY"
ACCOUNTING THEORY AND PRACTICE,"THEORY, FINANCE, STATISTICS, PRACTICAL, ANALYSIS, FEE, COST, PURCHASE, SHEETS, BALANCE, ACCOUNTING, MONEY"
COST ACCOUNTING,"FINANCE, STATISTICS, ANALYSIS, FEE, COST, PURCHASE, SHEETS, BALANCE, COST, ACCOUNTING, MONEY"
ACCOUNTING SYSTEMS,"BUSINESS, MANAGEMENT, FINANCE, STATISTICS, ANALYSIS, FEE, COST, PURCHASE, SHEETS, BALANCE, SYSTEMS, MONEY"
ADVANCED ACCOUNTING,"ADVANCED, FINANCE, STATISTICS, ANALYSIS, FEE, COST, PURCHASE, SHEETS, BALANCE, ADVANCED, ACCOUNTING, MONEY"
AUDITING,"TAX, FINANCE, STATISTICS, ACCOUNTING, AUDITING,  ANALYSIS, FEE, COST, PURCHASE, SHEETS, BALANCE"
TAX I,"TAX FINANCE, STATISTICS, ANALYSIS, FEE, COST, PURCHASE, SHEETS, BALANCE"
TAX II,"TAX, FINANCE, STATISTICS, ACCOUNTING, AUDITING, ANALYSIS, FEE, COST, PURCHASE, SHEETS, BALANCE"
ADVANCED AUDITING,"TAX, FINANCE, STATISTICS, ACCOUNTING, AUDITING, ANALYSIS, FEE, COST, PURCHASE, SHEETS, BALANCE"
RELIGION AND CULTURE,"RELIGION, SOCIETY, HUMANS, COMMUNITY, CULTURE, HUMANBEHAVIOR, WORLDSTUDIES, INTERNATIONALSTUDIES, CHILDREN, FAMILYSTUDIES, STUDY, BEHAVIOR, WORLDSTUDIES"
CURRENT ISSUES IN ACCOUNTING,"TAX, FINANCE, STATISTICS, ACCOUNTING, AUDITING,  ANALYSIS, FEE, COST, PURCHASE, SHEETS, BALANCE"
NATIVE AMERICANS,"RELIGION, SOCIETY, HUMANS, COMMUNITY, CULTURE, HUMANBEHAVIOR, WORLDSTUDIES, INTERNATIONALSTUDIES, CHILDREN, FAMILYSTUDIES, STUDY, BEHAVIOR, WORLDSTUDIES"
ELEMENTARY ARABIC I & II,"LANGUAGE, CULTURE, SOCIETY, INTRODUCTORY, ELEMENTARY, LANGUAGESTUDY, WORLDSTUDIES, ARABIC"
AN INTRODUCTION TO ARCHAEOLOGY,"HISTORY, INTRODUCTORY, ARCHAEOLOGY, HISTORY, ARTIFACTS, CULTURE"
AMERICAN CULTURE I,"LANGUAGE, CULTURE, SOCIETY, INTRODUCTORY, ELEMENTARY, LANGUAGESTUDY, WORLDSTUDIES, AMERICA, AMERICANSTUDIES"
AMERICAN CULTURE II,"LANGUAGE, CULTURE, SOCIETY, INTRODUCTORY, ELEMENTARY, LANGUAGESTUDY, WORLDSTUDIES, AMERICA, AMERICANSTUDIES"
INTERMEDIATE ARABIC I & II,"LANGUAGE, CULTURE, SOCIETY, INTERMEDIATE, LANGUAGESTUDY, WORLDSTUDIES, ARABIC"
ARABIC CULTURES AND PERSPECTIVES,"LANGUAGE, CULTURE, SOCIETY, ARABIC, WORLDSTUDIES, INTERNATIONALSTUDIES, COMMUNITY, CIVILIZATIONS"
THREE DIMENSIONAL DESIGN,"GRAPHICS, TECHNOLOGY, DIGITALMEDIA, DESIGN, COMPUTINGTECHNOLOGY, MEDIA, ART"
FUNDAMENTALS OF ART AND DESIGN,"ART, DESIGN, DRAWING, MEDIA, FUNDAMENTALS, DIGITALMEDIA, CREATIVE "
INTERMEDIATE PAINTING,"PAINTING, ART, DESIGN, DRAWING, MEDIA, FUNDAMENTALS, DIGITALMEDIA, CREATIVE "
BASIC SCULPTURE,"SCULPTING, ART, DESIGN, DRAWING, MEDIA, CREATIVE"
DRAWING II: MEDIA AND TECHNIQUES,"ART, DESIGN, DRAWING, MEDIA, FUNDAMENTALS, DIGITALMEDIA, CREATIVE, PAINTING"
INTERMEDIATE SCULPTURE,"SCULPTING, ART, DESIGN, DRAWING, MEDIA, CREATIVE, INTERMEDIATE "
BASIC PRINTMAKING,"PAINTING, ART, DESIGN, DRAWING, MEDIA, FUNDAMENTALS, DIGITALMEDIA, CREATIVE "
BASIC DRAWING,"PAINTING, ART, DESIGN, DRAWING, MEDIA, FUNDAMENTALS, DIGITALMEDIA, CREATIVE "
BASIC PAINTING,"PAINTING, ART, DESIGN, DRAWING, MEDIA, FUNDAMENTALS, DIGITALMEDIA, CREATIVE "
BASIC PHOTOGRAPHY,"PHOTOGRAPHY, ART, DESIGN, MEDIA, FUNDAMENTALS, DIGITALMEDIA, CREATIVE,CAMERA, CAPTURE, LENS"
DIGITAL LAYOUT AND DESIGN,"ART, DESIGN, DRAWING, MEDIA, FUNDAMENTALS, DIGITALMEDIA, CREATIVE, GRAPHICS, DIGITALDESIGN"
FIGURE DRAWING,"PAINTING, DRAWING, MEDIA, ART, DESIGN, FIGURES, HUMANS, CULTURE"
INTRODUCTION TO DIGITAL MEDIA,"MEDIA, TECHNOLOGY, INTRODUCTORY, DIGITALDESIGN, MEDIA, DIGITALMEDIA, COMPUTERGRAPHICS, ART"
DIGITAL PHOTOGRAPHY,"PHOTOGRAPHY, ART, DESIGN, MEDIA, FUNDAMENTALS, DIGITALMEDIA, CREATIVE,CAMERA, CAPTURE, LENS, TECHONOLOGY"
DIGITAL ANIMATION I,"TECHNOLOGY, MEDIA, DIGITALMEDIA, MEDIA, COMPUTERGRAPHICS, GRAPHICS, ART, ANIMATION, MOVING, "
INTERMEDIATE PHOTOGRAPHY,"PHOTOGRAPHY, ART, DESIGN, MEDIA, FUNDAMENTALS, DIGITALMEDIA, CREATIVE,CAMERA, CAPTURE, LENS, TECHONOLOGY, INTERMEDIATE"
ADVANCED PAINTING I,"PAINTING, ART, DESIGN, DRAWING, MEDIA, FUNDAMENTALS, CREATIVE, ADVANCED"
DIGITAL PAINTING,"PAINTING, MEDIA, TECHNOLOGY, ART, DESIGN, DRAWING, MEDIA, DIGITALMEDIA, CREATIVE, COMPUTERGRAPHICS"
MULTIMEDIA AUTHORING,"MEDIA, TECHNOLOGY, DIGITALDESIGN, MEDIA, DIGITALMEDIA, COMPUTERGRAPHICS, ART"
DESIGNING FOR THE WEB,"TECHNOLOGY, DESIGN, WEBSITE, WEBDESIGN, DIGITALMEDIA, MEDIA, COMPUTERS, CREATIVITY"
DRAWING III: ADVANCED PROJECTS,"PAINTING, ADVANCED, DRAWING, ART, CREATIVITY, MEDIA"
ADVANCED PHOTOGRAPHY,"PHOTOGRAPHY, ADVANCED, MEDIA, ART, CREATIVITY, CAMERA, SHOT"
DIGITAL ILLUSTRATION,"ART, DESIGN, TECHNOLOGY, DIGIALMEDIA, CREATIVITY, COMPUTERGRAPHICS, MEDIA, DRAWING"
ADVANCED PAINTING II,"PAINTING, ART, DESIGN, DRAWING, MEDIA, FUNDAMENTALS, CREATIVE, ADVANCED"
ADVANCED DRAWING II,"PAINTING, ART, DESIGN, DRAWING, MEDIA, FUNDAMENTALS, DIGITALMEDIA, CREATIVE "
ADVANCED SCULPTURE I,"SCULPTING, ART, DESIGN, DRAWING, MEDIA, CREATIVE, INTERMEDIATE "
ADVANCED SCULPTURE II,"SCULPTING, ART, DESIGN, DRAWING, MEDIA, CREATIVE, INTERMEDIATE "
MULTIMEDIA PROJECTS,"ART, DESIGN"
INTERACTIVE WEBSITE DESIGN,"TECHNOLOGY, DESIGN, WEBSITE, WEBDESIGN, DIGITALMEDIA, MEDIA, COMPUTERS, CREATIVITY"
DIGITAL ANIMATION III,"ART, DESIGN, DIGITALMEDIA, ANIMATION, CREATIVITY, TECHNOLOGY "
SENIOR THESIS: PORTFOLIO,"ART, PROJECT, SENIOR, CREATIVITY, DESIGN, PORTFOLIO"
HISTORY OF WESTERN ART I,"ART, WORLDSTUDIES, HISTORY, WESTERNSTUDIES"
HISTORY OF WESTERN ART II,"ART, WORLDSTUDIES, HISTORY, WESTERNSTUDIES"
PRE-COLUMBIAN ART,"ART, WORLDSTUDIES, HISTORY, WESTERNSTUDIES"
CHINESE ART,"ART, WORLD STUDIES, HISTORY, EATERNSTUDIES, ASIANSTUDIES, SOCIETY, CULTURE"
AMERICAN ART,"ART, AMERICANSTUDIES, HISTORY, WESTERNSTUDIES, CULTURE, SOCIETY"
HISTORY OF PHOTOGRAPHY,"ART, HISTORY, CAMERA, PHOTOGRAPHY"
HISTORY OF COSTUME,"ART, HISTORY, FASHION, CULTURE, WORLDSTUDIES"
GREEK AND ROMAN ART,"ART, WORLDSTUDIES, HISTORY, EATERNSTUDIES, SOCIETY, CULTURE"
MUSEUM STUDIES,"ART, WORLDSTUDIES, HISTORY, CUTLURE, EASTERNSTUDIES SOCIETY, WESTERNSTUDIES"
CONTEMPORARY ART,"ART, WORLD STUDIES, HISTORY, CREATIVITY, SOCIETY, MODERN"
MEDIEVAL ART,"ART, WORLDSTUDIES, HISTORY, CREATIVITY, SOCIETY, EASTERNSTUDIES, CULTURE, MEDIEVAL "
ART & TECHNOLOGY,"ART, TECHNOLOGY, CREATIVITY, DIGITALMEDIA, COMPUTINGTECHNOLOGY"
RENAISSANCE ART,"ART, WORLDSTUDIES, HISTORY, RENAISSANCE, CREATIVITY, SOCIETY, CULTURE, HUMANS "
ADVANCED INTERNSHIP,"ADVANCED, INTERNSHIP, HISTORY, ART"
CAPPING COURSE,"CAPPING, SENIOR, ART, PROJECT, HISTORY"
INTRODUCTION TO ATHLETIC TRAINING,"ATHLETICTRAINING, HUMANBODY, PHYSICAL,PHYSICALEDUCATION, BODY, SPORTS, ATHLETICS, WELLBEING"
EVALUATIONS FOR THE LOWER BODY.,"ATHLETICTRAINING, HUMANBODY, PHYSICAL,PHYSICALEDUCATION, BODY, SPORTS, ATHLETICS, WELLBEING"
EVALUATIONS FOR THE UPPER BODY.,"ATHLETICTRAINING, HUMANBODY, PHYSICAL,PHYSICALEDUCATION, BODY, SPORTS, ATHLETICS, WELLBEING"
ATHLETIC TRAINING INTERNSHIP,"ATHLETICTRAINING, HUMANBODY, PHYSICAL,PHYSICALEDUCATION, BODY, SPORTS, ATHLETICS, WELLBEING"
TOPICS IN BIOLOGY,"BIOLOGY, INTRODUCTORY, PLANTS, ANIMALS, CELLS, SCIENCE, LIFE"
GENERAL BIOLOGY I,"BIOLOGY, INTRODUCTORY, PLANTS, ANIMALS, CELLS, SCIENCE, LIFE"
GENERAL BIOLOGY II,"BIOLOGY, INTRODUCTORY, PLANTS, ANIMALS, CELLS, SCIENCE, LIFE"
HUMAN ANATOMY AND PHYSIOLOGY I,"BIOLOGY, HUMANBODY, HUMANS, BODY, PHYSICAL,ANATOMY, LIFE, BODILYFUNCTIONS"
HUMAN ANATOMY AND PHYSIOLOGY II,"BIOLOGY, HUMANBODY, HUMANS, BODY, PHYSICAL,ANATOMY, LIFE, BODILYFUNCTIONS"
HUMAN NUTRITION,"BIOLOGY, HUMANBODY, HUMANS, BODY, PHYSICAL,ANATOMY, LIFE, BODILYFUNCTIONS, NUTRITION, FOOD"
MICROBIOLOGY,"BIOLOGY, MICROBIOLOGY, BACTERIA, FUNGI, VIRUSES, MICRO, ORGANISMS, LIFE"
PLANT BIOLOGY,"BIOLOGY, ENVIRONMENT, PLANT, CELLS, PLANTCELLS, LIFE, ORGANISMS, FOOD"
IMMUNOLOGY,"BIOLOGY, HUMANBODY, IMMUNESYSTEM, BODILYFUNCTIONS, BODY, HUMANS, LIFE, VIRUSES"
GENETICS,"BIOLOGY, HUMANBODY, FORENSICS, HUMANS, DNA, BODILYFUNCTIONS, NATURAL"
LIFE ON EARTH,"BIOLOGY, ENVIORNMENT, LIFE, CELLS, ANIMALS, PLANTS, HUMANS, NATURAL, ORGANISMS"
"SEX, EVOLUTION AND BEHAVIOR","BIOLOGY, HUMANBODY, HUMANS, HUMANBEHAVIOR, BODY, PHYSICAL,ANATOMY, LIFE, BODILYFUNCTIONS"
EVOLUTION,"BIOLOGY, HUMANBODY, HUMANS, BODY, PHYSICAL, ANATOMY, LIFE, ORGANISMS, EVOLUTION"
HUMAN BIOLOGY,"BIOLOGY, HUMANBODY, HUMANS, BODY, PHYSICAL, ANATOMY, LIFE, BODILYFUNCTIONS"
HISTOLOGY,"BIOLOGY, HUMANBODY, HUMANS, BODY, PHYSICAL, ANATOMY, LIFE, BODILYFUNCTIONS, CELLS, SKIN, ANIMALS"
ANIMAL BEHAVIOR,"BIOLOGY, ENVIORNMENT, LIFE, CELLS, ANIMALS, NATURAL, ORGANISMS, BEHAVIOR"
FRESHWATER ECOLOGY,"BIOLOGY, ENVIORNMENT, LIFE, CELLS, ANIMALS, NATURAL, ORGANISMS, FRESHWATER, WATER, PLANTS"
ECOLOGY: PRINCIPLES & PRACTICE,"BIOLOGY, INTRODUCTORY, PLANTS, ANIMALS, CELLS, SCIENCE, LIFE, PRACTICAL"
SPECIAL TOPICS IN BIOLOGY I,"BIOLOGY, INTRODUCTORY, PLANTS, ANIMALS, CELLS, SCIENCE, LIFE"
SPECIAL TOPICS IN BIOLOGY II,"BIOLOGY, INTRODUCTORY, PLANTS, ANIMALS, CELLS, SCIENCE, LIFE"
SPECIAL TOPICS IN BIOLOGY III,"BIOLOGY, INTRODUCTORY, PLANTS, ANIMALS, CELLS, SCIENCE, LIFE"
INVERTEBRATE ZOOLOGY,"BIOLOGY, INTRODUCTORY, PLANTS, ANIMALS, CELLS, SCIENCE, LIFE, INVERTEBRATE, ZOO"
PLANT PHYSIOLOGY,"BIOLOGY, ENVIRONMENT, PLANT, CELLS, PLANTCELLS, LIFE, ORGANISMS, FOOD"
ADVANCED HUMAN PHYSIOLOGY,"BIOLOGY, HUMANBODY, HUMANS, BODY, PHYSICAL, ANATOMY, LIFE, BODILYFUNCTIONS"
BIOTECHNOLOGY,"BIOLOGY, TECHNOLOGY, MODERN, LIFE, ORGANISMS, DNA, ENGINEERING, MEDICINE"
DEVELOPMENTAL BIOLOGY,"BIOLOGY, TECHNOLOGY, MODERN, LIFE, ORGANISMS, DNA, ENGINEERING, MEDICINE"
PARASITOLOGY,"BIOLOGY, PARASITES, SICKNESS, HEALTH, LIFE, ORGANISMS, DISEASE, ANIMALS, PLANTS"
CAPPING COURSE,"BIOLOGY, SCIENCE, CAPPING, SENIOR"
MOLECULAR BIOLOGY,"BIOLOGY, MOLECULES, PLANTS, ANIMALS, CELLS, CELLSTRUCTURE, DNA"
ORGANIZATIONAL BEHAVIOR,"BIOLOGY, BEHAVIOR, PLANTS, ANIMALS, ENVIRONMENT"
BIOLOGY INTERNSHIP,"BIOLOGY, INTERNSHIP, SCIENCE"
FINANCIAL LITERACY,"BUSINESS, BUSINESSADMINISTRATION, FINANCE, LITERACY, MONEY, BILLS, TAXES, LIFE, STOCKS, INVESTING, MORTGAGE, SAVINGS, JOB"
GLOBAL BUSINESS & SOCIETY,"BUSINESS, BUSINESSADMINISTRATION, SOCIETY, GLOBAL, INTERNATIONAL, WORLDSTUDIES"
HUMAN RESOURCE MANAGEMENT,"BUSINESS, BUSINESSADMINISTRATION, HUMANS, HUMANRESOURCES, HUMANBEHAVIOR, CONDUCT"
FINANCIAL MANAGEMENT,"FINANCE, MONEY, TAXES, BUSINESS, BUSINESSADMINISTRATION,MANAGEMENT, WEALTH"
MARKETING PRINCIPLES,"MARKETING, FINANCE, PRINCIPLES, ADVERTISING, MONEY, SALES, BUSINESS, BUSINESSADMINISTRATION"
ENTREPRENEURSHIP,"BUSINESS, BUSINESSADMINISTRATION, ENTREPRENEURSHIP, MONEY, SALES, PERSONAL"
BUSINESS LAW I,"BUSINESS, BUSINESSADMINISTRATION, LAW, CORPORATE, PEOPLE, REGULATIONSS"
BUSINESS LAW II,"BUSINESS, BUSINESSADMINISTRATION, LAW, CORPORATE, PEOPLE, REGULATIONSS"
INVESTMENT ANALYSIS,"BUSINESS, BUSINESSADMINISTRATION, INVESTING, FINANCE, MONEY, STOCKS, ANALYSIS, BONDS"
OPERATIONS MANAGEMENT,"BUSINESS, BUSINESSADMINISTRATION, OPERATIONS, MONEY, EXCEL, CASHFLOWS, TAXES, SUPPLYANDDEMAND, OPERATIONCHAIN"
CORPORATE FINANCE,"BUSINESS, BUSINESSADMINISTRATION, CORPORATE, FINANCE, MONEY, CASHFLOWS, REGULATIONS"
LEGAL FOUNDATION OF BUSINESS,"BUSINESS, BUSINESSADMINISTRATION, LAW, CORPORATE, PEOPLE, REGULATIONSS, PEOPLE"
INVESTMENT PRACTICUM: EQUITIES,"BUSINESS, BUSINESSADMINISTRATION, INVESTING, STOCKS, PRACTICAL, EQUITIES, BONDS, TRADING"
LABOR RELATIONS,"BUSINESS, BUSINESSADMINISTRATION, PEOPLE, WORK, LABOR, HUMANS, RELATIONSHIPS"
INVESTMENT PRACTICUM: FIXED INCOME,"BUSINESS, BUSINESSADMINISTRATION, INVESTING, STOCKS, PRACTICAL, EQUITIES, BONDS, TRADING"
COMPENSATION ADMINISTRATION,"BUSINESS, BUSINESSADMINISTRATION, INVESTING, STOCKS, PRACTICAL, EQUITIES, BONDS, TRADING"
EMPLOYMENT AND DEVELOPMENT,"BUSINESS, BUSINESSADMINISTRATION, LABOR, EMPLOYMENT, HUMANS, WORKPLACE"
INTERNATIONAL TRADE MANAGEMENT,"BUSINESS, BUSINESSADMINISTRATION, INVESTING, STOCKS, PRACTICAL, EQUITIES, BONDS, TRADING, INTERNATIONALTRADING"
MARKETING COMMUNICATIONS,"MARKETING, FINANCE, PRINCIPLES, ADVERTISING, MONEY, SALES, BUSINESS, BUSINESSADMINISTRATION, COMMUNICATIONS"
MARKETING POLICIES & PROBLEMS,"MARKETING, FINANCE, PRINCIPLES, ADVERTISING, MONEY, SALES, BUSINESS, BUSINESSADMINISTRATION"
MANAGEMENT STRATEGY AND POLICY,"MARKETING, FINANCE, PRINCIPLES, ADVERTISING, MONEY, SALES, BUSINESS, BUSINESSADMINISTRATION"
MARKETING RESEARCH,"MARKETING, FINANCE, PRINCIPLES, ADVERTISING, MONEY, SALES, BUSINESS, BUSINESSADMINISTRATION"
INTERNATIONAL MARKETING,"MARKETING, FINANCE, PRINCIPLES, ADVERTISING, MONEY, SALES, BUSINESS, BUSINESSADMINISTRATION, INTERNATIONAL"
EMPLOYMENT PRACTICUM,"PRACTICAL, CAREER, CAREERDEVELOPMENT, GROWTH, PERSONAL"
PRINCIPLES OF ORGANIC CHEMISTRY,"CHEMISTRY, ELEMENTS, ENERGY, ATOMS, PARTICLES, ORGANIC, CARBON, REACTIONS, LIFE"
CATHOLIC THOUGHT AND SPIRITUALITY,"RELIGION, RELIGIOUSSTUDIES, CATHOLICSTUDIES, SPIRTUALITY, PEOPLE, BELIEFSYSTEMS"
INTRODUCTION TO CHEMISTRY,"CHEMISTRY, INTRODUCTORY, ELEMENTS, ENERGY, ATOMS, PARTICLES"
COMPUTATIONAL CHEMISTRY,"CHEMISTRY, ELEMENTS, ENERGY, ATOMS, PARTICLES, MATH, EQUATIONS"
ORGANIC CHEMISTRY I,"CHEMISTRY, ELEMENTS, ENERGY, ATOMS, PARTICLES, ORGANIC, CARBON, REACTIONS, LIFE"
ORGANIC CHEMISTRY II,"CHEMISTRY, ELEMENTS, ENERGY, ATOMS, PARTICLES, ORGANIC, CARBON, REACTIONS, LIFE"
ORGANIC CHEMISTRY LABORATORY I,"CHEMISTRY, ELEMENTS, ENERGY, ATOMS, PARTICLES, ORGANIC, CARBON, REACTIONS, LIFE, LAB"
ORGANIC CHEMISTRY LABORATORY II,"CHEMISTRY, ELEMENTS, ENERGY, ATOMS, PARTICLES, ORGANIC, CARBON, REACTIONS, LIFE, LAB"
PRINCIPLES OF BIOCHEMISTRY,"CHEMISTY, BIOLOGY, BIOCHEMISTRY, PRINCIPLES, LIFE, ATOMS, ORGANISMS, PARTICLES"
ENVIRONMENTAL CHEMISTRY LABORATORY,"CHEMISTRY, LAB, ENVIRONMENT, ORGANISMS, BIOCHEMISTRY"
ENVIRONMENTAL CHEMISTRY,"CHEMISTRY, ENVIRONMENT, ORGANISMS, BIOCHEMISTRY"
MECHANICS,"CHEMISTRY, MECHANICALCHEMISTRY, STRUCTURE, PARTICLES"
BIOCHEMISTRY I,"BIOCHEMISTRY, CELLS, MOLECULES, CHEMISTRY, BIOLOGY, PROCESSES"
ANALYTICAL CHEMISTRY,"CHEMISTRY, MATH, ANALYTICS, PARTICLES, ENERGY, CALCULATIONS"
THERMODYNAMICS & KINETICS,"CHEMISTRY, MATH, ANALYTICS, PARTICLES, ENERGY, CALCULATIONS, HEAT, TEMPERATURE"
QUANTUM & STATISTICAL MECHANICS,"CHEMISTRY, MECHANICALCHEMISTRY, STRUCTURE, PARTICLES, STATISTICS, COMPUTATIONS, CALCULATIONS, QUANTUMMECHANICS"
BIOCHEMISTRY II,"BIOCHEMISTRY, CELLS, MOLECULES, CHEMISTRY, BIOLOGY, PROCESSES"
BIOCHEMISTRY LABORATORY I,"BIOCHEMISTRY, CELLS, MOLECULES, CHEMISTRY, BIOLOGY, PROCESSES, LAB"
BIOCHEMISTRY LABORATORY II,"BIOCHEMISTRY, CELLS, MOLECULES, CHEMISTRY, BIOLOGY, PROCESSES, LAB"
ADVANCED INORGANIC CHEMISTRY,"CHEMISTRY, ELEMENTS, ENERGY, ATOMS, PARTICLES, INORGANIC, CARBON, REACTIONS, LIFE, ADVANCED"
ADVANCED ORGANIC CHEMISTRY,"CHEMISTRY, ELEMENTS, ENERGY, ATOMS, PARTICLES, ORGANIC, CARBON, REACTIONS, LIFE, ADVANCED"
POLYMER CHEMISTRY,"CHEMISTRY, ELEMENTS, ENERGY, ATOMS, PARTICLES, ORGANIC, CARBON, REACTIONS, LIFE"
RESEARCH METHODS IN CHEMISTRY II,"CHEMISTRY, ELEMENTS, ENERGY, ATOMS, PARTICLES, ORGANIC, CARBON, REACTIONS, LIFE, RESEARCH, STUDY"
RESEARCH METHODS IN CHEMISTRY III,"CHEMISTRY, ELEMENTS, ENERGY, ATOMS, PARTICLES, ORGANIC, CARBON, REACTIONS, LIFE, RESEARCH, STUDY"
INTERMEDIATE CHINESE I & II,"INTERMEDIATE, CHINESE, LANGUAGESTUDY, INTERNATIONALSTUDIES, LANGUAGE, ASIANSTUDIES"
PUBLIC PRESENTATION,"PUBLICSPEAKING, SPEECH, PRESENTATION, TALKING, HUMANS, COMMUNICATIONS "
INTRODUCTION TO COMMUNICATION,"INTRODUCTORY, PRESENTATIONS, HUMANS, SPEAKING, COMMUNICATIONS, RELATIONSHIPS"
DIGITAL TOOLBOX,"DIGITAL, DIGITALTOOLS, COMMUNICATIONS, LEARNING, ONLINE"
SPECIAL TOPICS IN COMMUNICATION,"COMMUNICATIONS, SPECIALTOPICS, RELATIONSHIPS, HUMANS, SPEAKING"
ELEMENTARY CHINESE I & II,"ELEMENTARY, CHINESE, LANGUAGESTUDY, INTERNATIONALSTUDIES, LANGUAGE, ASIANSTUDIES"
INTERPERSONAL COMMUNICATION,"PRESENTATIONS, HUMANS, SPEAKING, COMMUNICATIONS, RELATIONSHIPS"
ARGUMENTATION AND DEBATE,"COMMUNICATIONS, DEBATE, SPEECH, PRESENTATION, HUMANS, TALKING, ARGUMENTS"
PUBLIC RELATIONS WRITING TOOLS,"RELATIONS, WRITING, TOOLS, COMMUNICATIONS, PEOPLE, SPEAKING"
INTRODUCTION TO JOURNALISM,"JOURNALISM, INTRODUCTORY, WRITING, ARTICLES, JOURNALIST, NEWS"
JOURNALISM SKILLS,"JOURNALISM, INTRODUCTORY, WRITING, ARTICLES, JOURNALIST, NEWS"
"SPORT, CULTURE, AND COMMUNICATION","CULTURE, COMMUNICATIONS, JOURNALISM, SPORTS, WRITING, NEWS"
BROADCASTING,"TELEVISION, SPORTS, COMMUNICATION, NEWS, PRESENTATION, PUBLIC"
MASS COMMUNICATION LAW,"COMMUNICATIONS, LAW, HUMANS, RELATIONSHIP, PUBLIC, REGULATIONSS"
NEWS EDITING,"NEWS, JOURNALISM, PUBLIC, EDITING, ARTICLES, WRITING"
SMALL GROUP COMMUNICATION,"COMMUNICATIONS, PEOPLE, PUBLICPRESENTATION, SPEECH"
PERSUASION,"COMMUNICATIONS, SPEECH, TOOLS, SKILLS, TECHNIQUES, TALKING"
SEMINAR IN COMMUNICATION,"COMMUNICATIONS, SPEECH, TOOLS, SKILLS, TECHNIQUES, TALKING"
INTERNSHIP IN COMMUNICATION,"COMMUNICATIONS, SPEECH, TOOLS, SKILLS, TECHNIQUES, TALKING, INTERNSHIP"
MEDIA STRATEGY,"MEDIA, JOURNALISM ,NEWS, PUBLIC, STRATEGY, PRESENTATION, COMMUNICATIONS, BROADCAST"
NEWSWRITING,"NEWS, JOURNALISM, PUBLIC, EDITING, ARTICLES, WRITING"
PUBLIC AFFAIRS REPORTING,"PUBLICAFFAIRS, PUBLICRELATIONS, COMMUNICATIONS, NEWS, MEDIA,  REPORTING"
RESEARCH AND CONSUMER INSIGHT,"CONSUMER, RESEARCH, MARKETING, BUSINESS, MONEY, SALES, PEOPLE"
INTERCULTURAL COMMUNICATION,"CULTURE, COMMUNICATIONS, PEOPLE, HUMANS, SOCIETY, RELATIONSHIPS"
MAGAZINE WRITING,"JOURNALISM, WRITING, MEDIA, NEWS, ARTICLES, MAGAZINES, READING "
MAGAZINE LAYOUT AND DESIGN,"JOURNALISM, WRITING, MEDIA, NEWS, ARTICLES, MAGAZINES, DESIGN, GRAPHICDESIGN"
CREATIVE PROBLEM SOLVING,"CREATIVITY, PROBLEMSOLVING, THINKING, CRITICALTHINKING"
COMMUNICATION ETHICS,"COMMUNICATIONS, HUMANS, BEHAVIOR, ETHICS, PEOPLE"
RADIO NEWS I,"RADIO, BROADCAST, NEWS, PUBLIC, SPEECH, TALKING, PEOPLE, COMMUNICATIONS, MEDIA"
BROADCAST NEWS WRITING,"RADIO, BROADCAST, NEWS, PUBLIC, SPEECH, TALKING, PEOPLE, COMMUNICATIONS, MEDIA"
PRODUCING THE NEWSCAST,"RADIO, BROADCAST, NEWS, PUBLIC, SPEECH, TALKING, PEOPLE, COMMUNICATIONS, MEDIA"
APPLIED RESEARCH AND ANALYTICS,"RESEARCH, ANALYTICS, NEWS, PUBLIC, DATA"
PRESS IN AMERICA,"RADIO, BROADCAST, NEWS, PUBLIC, SPEECH, TALKING, PEOPLE, COMMUNICATIONS, MEDIA"
SEX AND THE MEDIA,"RADIO, BROADCAST, NEWS, PUBLIC, SPEECH, TALKING, PEOPLE, COMMUNICATIONS, MEDIA, GENDERSTUDIES"
VISUAL STORYTELLING,"VISUALS, MEDIA, NEWS, PUBLIC, SPEECH, STORY, GRAPHICS"
READINGS IN JOURNALISM,"JOURNALISM, INTRODUCTORY, WRITING, ARTICLES, JOURNALISM, NEWS, READING"
PHOTOJOURNALISM,"PHOTOGRAPHY, JOURNALISM, MEDIA,CAMERA, ARTICLES, NEWS"
ISSUES IN SPORTS MEDIA,"SPORTS, MEDIA, NEWS, JOURNALISM, WRITING"
"GENDER, CULTURE AND COMMUNICATION","GENDERSTUDIES, COMMUNICATIONS, PEOPLE, CULTURE, HUMANBEHAVIOR, RELATIONSHIPS"
COMMUNICATION CAPPING,"COMMUNICATIONS, SPEECH, TOOLS, SKILLS, TECHNIQUES, TALKING, CAPPING, SENIOR"
COMMUNICATION CAMPAIGN MANAGEMENT,"COMMUNICATIONS, SPEECH, TOOLS, SKILLS, TECHNIQUES, TALKING, CAMPAIGN, MANAGMENT"
ADVANCED PUBLIC PRESENTATIONS,"RELATIONS, WRITING, TOOLS, COMMUNICATIONS, PEOPLE, SPEAKING, PRESENTATIONS"
ADVANCED COPYWRITING,"COPYWRITING, WRITING, JOURNALISM ,MEDIA, PRESS, PUBLIC, ADVANCED"
ADVERTISING RESEARCH,"ADVERTISING, MARKETING, RESEARCH, BUSINESS, SALES, PEOPLE, ADVANCED"
RADIO NEWS II,"RADIO, BROADCAST, NEWS, PUBLIC, SPEECH, TALKING, PEOPLE, COMMUNICATIONS, MEDIA"
BRANDING,"MARKETING, ADVERTISING, SALES, BUSINESS, DESIGN, GRAPHICDESIGN, PUBLICPRESENTATION"
SPORTS BROADCASTING,"SPORTS, BROADCAST, JOURNALISM, PUBLIC, SPEECH, TELEVISION, RADIO"
COMMUNICATION THEORY,"THEORY, COMMUNICATIONS, SPEECH, SPEAKING, RELATIONS, PUBLIC"
ADVOCACY JOURNALISM,"JOURNALISM, INTRODUCTORY, WRITING, ARTICLES, JOURNALISM, NEWS, READING, RELATIONS"
SPECIALIZED JOURNALISM,"JOURNALISM, INTRODUCTORY, WRITING, ARTICLES, JOURNALISM, NEWS, READING"
SPORTS REPORTING,"SPORTS, BROADCAST, JOURNALISM, PUBLIC, SPEECH, TELEVISION, RADIO"
SPORTS PUBLIC RELATIONS,"SPORTS, BROADCAST, JOURNALISM, PUBLIC, SPEECH, TELEVISION, RADIO, RELATIONS"
JOURNALISM PRAXIS,"JOURNALISM, WRITING, ARTICLES, JOURNALIST, NEWS, PRACTICAL"
ALTERNATIVE JOURNALISM,"JOURNALISM, WRITING, ARTICLES, JOURNALIST, NEWS, PRACTICAL"
JOURNALISM WORKSHOP,"JOURNALISM, WRITING, ARTICLES, JOURNALIST, NEWS, PRACTICAL"
COMPARATIVE COMMUNICATION SYSTEMS,"COMMUNICATIONS, SPEECH, TOOLS, SKILLS, TECHNIQUES, TALKING, SYSTEMS"
MS EXCEL,"COMPUTINGTECHNOLOGY, EXCEL, SKILLS, TOOLS, COMPENTANCY "
GAME STUDIES SEMINAR,"GAMING, GAMEDESIGN, TECHNOLOGY, DESIGN, COMPUTINGTECHNOLOGY"
SOFTWARE DEVELOPMENT II,"SOFTWARE, COMPUTINGTECHNOLOGY, SOFTWAREDEVELOPMENT, CODING, PHP, HTML, SQL"
SOFTWARE SYSTEMS AND ANALYSIS,"SOFTWARE, SYSTEMS, ANALYSIS, COMPUTINGTECHNOLOGY, BUSINESS, DEVELOPMENT"
MANAGEMENT INFORMATION SYSTEMS,"INFORMATIONSYSTEMS, MANAGEMENT, PROJECTMANAGER, COMPUTINGTECHNOLOGY"
INTRODUCTION TO PROGRAMMING,"PYTHON, COMPUTINGTECHNOLOGY, CODING, INTRODUCTORY, FUNDAMENTALS, PROGRAMMING"
"TECHNOLOGY, ETHICS, AND SOCIETY","ETHICS, SOCIETY, COMPUTINGTECHNOLOGY, WRITING, ARTICLES"
SOFTWARE DEVELOPMENT I,"COMPUTINGTECHNOLOGY, JAVA, CODING, OOP, PROGRAMMING, SOFTWARE, SOFTWAREDEVELOPMENT"
DATA COMMUNICATIONS AND NETWORKS,"INFORMATIONTECHNOLOGY, IT, DATA, COMMUNICATIONS, NETWORKING, DEVICES"
INTERNETWORKING,"INFORMATIONTECHNOLOGY, IT, DATA, COMMUNICATIONS, NETWORKING, DEVICES"
INTRODUCTION TO Z/OS NETWORKING,"NETWORKING, COMPUTINGTECHNOLOGY, INFORMATIONTECHNOLOGY, OPERATINGSYSTEMS, INTRODUCTORY, IBM, ZOS"
DATABASE MANAGEMENT,"SQL, DATA, DATABASES, QUERY, ORGANIZATIONS, FILTERING, SORTING, SEARCHING"
INTRODUCTION TO Z/OS SECURITY,"SECURITY, OPERATINSYSTEMS, CYBERSECURITY, IBM, ZOS"
PROJECT MANAGEMENT,"INFORMATIONSYSTEMS, PROJECTMANAGEMENT, LEAD, PROJECT, PEOPLE, RELATIONS, ORGANIZATION"
UNIX,"UNIX, OPERATINGSYSTEMS, COMPUTERSCIENCE, PROGRAMMING, CODING"
SYSTEM DESIGN,"DESIGN, CSS, HTML, WEBDESIGN, DIGITALDESIGN, WEBSITE, SYSTEMS"
THEORY OF PROGRAMMING LANGUAGES,"THEORY, LANGUAGESTUDY, LETLANG, COMPILERS, PROGRAMMING, CODING, SYNTAX"
LANGUAGE STUDY,"LANGUAGESTUDY, CODING, THEORY, SYNTAX"
E-COMMERCE DEVELOPMENT AND DESIGN,"ECOMMERCE, BUSINESS, DESIGN, CODING, WEBSITE, ONLINE, DEVELOPMENT"
INTRODUCTION TO CYBERSECURITY,"CYBERSECURITY, CODING, HACKING, COMPUTINGTECHNOLOGY, SECURITY, TESTING, CODING"
HACKING AND PENETRATION TESTING,"CYBERSECURITY, CODING, HACKING, COMPUTINGTECHNOLOGY, SECURITY, TESTING, CODING"
ROBOTICS,"ENGINEERING, PROGRAMMING, ROBOTICS, CODING, COMPUTINGTECHNOLOGY"
GAME DESIGN AND PROGRAMMING I,"GAMING, GAMEDESIGN, TECHNOLOGY, DESIGN, COMPUTINGTECHNOLOGY, PROGRAMMING"
GAME DESIGN AND PROGRAMMING II,"GAMING, GAMEDESIGN, TECHNOLOGY, DESIGN, COMPUTINGTECHNOLOGY, PROGRAMMING"
MOBILE SECURITY,"CYBERSECURITY, CODING, HACKING, COMPUTINGTECHNOLOGY, SECURITY, TESTING, CODING, MOBILE"
INTERNET SECURITY,"CYBERSECURITY, CODING, HACKING, COMPUTINGTECHNOLOGY, SECURITY, TESTING, CODING, INTERNET"
OPERATING SYSTEMS,"TYPESCRIPT, CODING, PROGRAMMING, OPERTATINGSYSTEMS, SYSTEMS, HTML, DEBUGGING, DESIGN, COMPUTINGTECHNOLOGY"
DISTRIBUTED SYSTEMS,"SYSTEMS, COMPUTINGTECHNOLOGY, OPERATINGSYSTEMS, CODING, PROGRAMMING, COMPUTERS"
WIRELESS COMMUNICATIONS,"WIRELESS, NETWORK, NETWORKING, INFORMATIONTECHNOLOGY, DEVICES, MOBILE,  COMMUNICATIONS"
DATA AND INFORMATION MANAGEMENT,"DATA, DATAMANAGEMENT, INFORMATIONTECHNOLOGY, COMMUNICATIONS, DATABASE, NETWORKING"
TECHNOLOGY ENTREPRENEURSHIP,"COMPUTINGTECHNOLOGY, ENTREPRENEURSHIP, PERSONAL, TECHNOLOGY, PEOPLE, GROWTH"
DESIGN OF COMPILERS,"COMPILERS, CODING, LANGUAGESTUDY, PROGRAMMING, DESIGN, SOFTWARE, COMPUTINGTECHNOLOGY"
ALGORITHM ANALYSIS AND DESIGN,"MATH, ALGORITHMS, DESIGN, ANALYSIS, COMPUTERSCIENCE,  PATTERNS, SORTING, SEARCHING"
FORMAL LANGUAGES AND COMPUTABILITY,"LANGUAGESTUDY, COMPUTINGTECHNOLOGY, CODING, COMPUTERSCIENCE, LANGUAGE, COMPILING "
COMPUTER GRAPHICS,"COMPUTERGRAPHICS, DIGITALGRAPHICS, GRAPHICS, COMPUTINGTECHNOLOGY, DESIGN, CREATIVITY, DIGITALDESIGN"
Z/OS ADVANCED TOPICS,"IBM, ZOS, COMPUTERSCIENCE, COMPUTINGTECHNOLOGY"
Z/OS EMERGING TECHNOLOGIES,"IBM, ZOS, COMPUTERSCIENCE, COMPUTINGTECHNOLOGY"
Z/OS INSTALLATION,"IBM, ZOS, COMPUTERSCIENCE, COMPUTINGTECHNOLOGY"
Z/OS PERFORMANCE FUNDAMENTALS,"IBM, ZOS, COMPUTERSCIENCE, COMPUTINGTECHNOLOGY"
ADVANCED TOPICS IN CS,"ADVANCED, TOPICS, COMPUTERSCIENCE, COMPUTINGTECHNOLOGY"
ADVANCED TOPICS IN ITS,"ADVANCED, TOPICS, INFORMATIONTECHNOLOGY, INFORMATIONSYSTEMS"
ADVANCED TOPICS IN CS,"ADVANCED, TOPICS, COMPUTERSCIENCE, COMPUTINGTECHNOLOGY"
ADVANCED TOPICS IN ITS,"ADVANCED, TOPICS, INFORMATIONTECHNOLOGY, INFORMATIONSYSTEMS"
IS POLICY,"ADVANCED, TOPICS, INFORMATIONSYSTEMS, INFORMATIONTECHNOLOGY, COMPUTINGTECHNOLOGY, CAPPNG, PROJECT, SENIOR"
CS PROJECT I,"ADVANCED, TOPICS, COMPUTERSCIENCE, COMPUTINGTECHNOLOGY, CAPPNG, PROJECT, SENIOR"
CS PROJECT II,"ADVANCED, TOPICS, COMPUTERSCIENCE, COMPUTINGTECHNOLOGY, CAPPNG, PROJECT, SENIOR"
ADVANCED TECHNOLOGY INTERNSHIP,"NFORMATIONSYSTEMS, INFORMATIONTECHNOLOGY, COMPUTINGTECHNOLOGY, INTERNSHIP"
ITS PROJECT I,"ADVANCED, TOPICS, INFORMATIONSYSTEMS, INFORMATIONTECHNOLOGY, COMPUTINGTECHNOLOGY, CAPPNG, PROJECT, SENIOR"
CRIMINOLOGY,"CRIMINALS, CRIMINALJUSTICE, PEOPLE, HUMANBEHAVIOR, LAW"
ITS PROJECT II,"ADVANCED, TOPICS, INFORMATIONSYSTEMS, INFORMATIONTECHNOLOGY, COMPUTINGTECHNOLOGY, CAPPNG, PROJECT, SENIOR"
CLOUD INFRASTRUCTURE AND SERVICES,"CLOUDCOMPUTING, CLOUD, INFRASTRUCTURE, SYSTEMS"
ADVANCED FACILITIES MANAGEMENT,"INFRASTRUCTURE, SYSTEMS, MANAGEMENT"
INTRODUCTION TO CRIMINAL JUSTICE,"INTRODUCTORY, CRIMINALJUSTICE, LAW, PEOPLE, REGULATIONSS, HUMANBEHAVIOR, FORENSICS, BEHAVIOR"
LAW AND SOCIETY,"LAW, SOCIETY, PEOPLE, HUMANBEHAVIOR, REGULATIONSS, CULTURE, HUMANS, COMMUNITY,  CRIMINALJUSTICE"
POLICING IN AMERICA,"POLICY, AMERICANSTUDIES, SOCIETY, REGULATIONSS, LAW, CULTURE, HUMANBEHAVIOR, PEOPLE,  CRIMINALJUSTICE"
CORRECTIONS AND PENOLOGY,"REGULATIONS, RULES, LAW, POLICY, PEOPLE, HUMANBEHAVIOR, CRIMINALJUSTICE"
