class_name,tags
DRUG AND ALCOHOL USE AND ABUSE,"HUMANBEHAVIOR, LAW, MEDICINE, DRUGS, CRIMINALJUSTICE, DRUGABUSE, CRIMINALS, PEOPLE"
CRIMINAL LAW AND PROCEDURE," CRIMINALJUSTICE, LAW, RULES, REGULATIONSS, SOCIETY, CRIMINALS"
ORGANIZED CRIME," CRIMINALJUSTICE, LAW, RULES, REGULATIONSS, SOCIETY, CRIMINALS, HUMANS, PEOPLE, CRIME"
THEORIES OF PUNISHMENT," CRIMINALJUSTICE, LAW, RULES, REGULATIONSS, SOCIETY, CRIMINALS, HUMANS, PEOPLE, CRIME"
CRIMINAL JUSTICE RESEARCH METHODS," CRIMINALJUSTICE, LAW, RULES, REGULATIONSS, SOCIETY, CRIMINALS, HUMANS, PEOPLE, CRIME"
CRIMINAL JUSTICE ETHICS," CRIMINALJUSTICE, LAW, RULES, REGULATIONSS, SOCIETY, CRIMINALS, HUMANS, PEOPLE, CRIME"
TERRORISM," CRIMINALJUSTICE, LAW, RULES, REGULATIONSS, SOCIETY, CRIMINALS, HUMANS, PEOPLE, CRIME"
RACE AND CRIME," CRIMINALJUSTICE, LAW, RULES, REGULATIONSS, SOCIETY, CRIMINALS, HUMANS, PEOPLE, CRIME, CULTURE"
SENIOR SEMINAR: CAPPING COURSE,"CRIMINALJUSTICE, LAW, PEOPLE, REGULATIONSS, HUMANBEHAVIOR, FORENSICS, BEHAVIOR, CAPPING, SENIOR, PROJECT"
THE CIVILIZATION OF JAPAN,"ASIANSTUDIES, CULTURE, WORLDSTUDIES, SOCIETY, CIVILIZATIONS, JAPAN, PEOPLE, COMMUNITY"
ARABIC CULTURES AND PERSPECTIVES,"ARABIC, EASTERNSTUDIES, WORLDSTUDIES, INTERNATIONALSTUDIES, CULTURE, PEOPLE, SOCIETY, PEOPLE"
CULTURES OF SPAIN,"SPAIN, EUROPE, EASTERNSTUDIES, WORLDSTUDIES, INTERNATIONALSTUDIES, CULTURE, PEOPLE, SOCIETY, PEOPLE"
CULTURES OF THE HISPANIC CARIBBEAN,"CARIBBEAN, SPANISH, EASTERNSTUDIES, WORLDSTUDIES, INTERNATIONALSTUDIES, CULTURE, PEOPLE, SOCIETY, PEOPLE"
INTRODUCTION TO GLOBAL ISSUES,"WORLDSTUDIES, GLOBALSTUDIES, GLOBALISSUES, CULTURE, PEOPLE, HUMANS, SOCIETY"
FRANCE & THE WORLD,"FRANCE, EUROPE, SOCIETY, EASTERNSTUDIES, EUROPEANSTUDIES, WORLDSTUDIES, COMMUNITY, GLOBALSTUDIES"
FRENCH CULTURE & THOUGHT:,"FRANCE, EUROPE, SOCIETY, EASTERNSTUDIES, EUROPEANSTUDIES, WORLDSTUDIES, COMMUNITY, GLOBALSTUDIES"
CULTURES OF LATIN AMERICA,"SPANISH, WESTERNSTUDIES, WORLDSTUDIES, INTERNATIONALSTUDIES, CULTURE, PEOPLE, SOCIETY, PEOPLE"
THEMES IN SPANISH CINEMA,"SPANISH, WESTERNSTUDIES, WORLDSTUDIES, INTERNATIONALSTUDIES, CULTURE, PEOPLE, SOCIETY, PEOPLE, FILM, MOVIES, ACTING, ACTORS"
THEMES IN LATIN AMERICAN CINEMA,"SPANISH, WESTERNSTUDIES, WORLDSTUDIES, INTERNATIONALSTUDIES, CULTURE, PEOPLE, SOCIETY, PEOPLE, FILM, MOVIES, ACTING, ACTORS"
INTRODUCTION TO DATA ANALYSIS,"DATA, ANALYSIS, ANALYTICS, DATASCIENCE, DATAANALYSIS, STATISTICS, R"
THE CIVILIZATION OF ITALY,"ITALY, WORLDSTUDIES, EUROPE, EUROPEANSTUDIES, EASTERNSTUDIES, CIVILIZATIONS, PEOPLE, WORLDHISTORY"
DATA VISUALIZATION,"DATA, ANALYSIS, ANALYTICS, DATASCIENCE, DATAANALYSIS, STATISTICS, R, COMPUTERGRAPHICS, VISUALIZATION, DATAVISUALIZATION, CHARTS, TABLES"
MACHINE LEARNING,"ARTIFICIALINTELLIGENCE, MACHINELEARNING, COMPUTERSCIENCE, COMPUTINGTECHNOLOGY, COMPUTERENGINEERING, DATASCIENCE, DATA"
ECONOMICS OF GENDER,"ECONOMICS, GENDERSTUDIES, SEX, GENDER, SOCIETY, CIVILIZATION, WORLDSTUDIES"
DATA MINING & PREDICTIVE ANALYTICS,"DATA, ANALYSIS, ANALYTICS, DATASCIENCE, DATAANALYSIS, STATISTICS, R, DATAMINING, DATAPREDICTION, PREDICTIVE"
DATA SCIENCE PROJECT (CAPSTONE),"DATA, ANALYSIS, ANALYTICS, DATASCIENCE, DATAANALYSIS, STATISTICS, R, DATAMINING, DATAPREDICTION, PREDICTIVE, CAPSTONE"
PRINCIPLES OF MICROECONOMICS,"ECONOMICS, SUPPLYANDDEMAND, SUPPLY, DEMAND, MONEY, INVESTING, TAX, BUSINESS, PRICES"
PRINCIPLES OF MACROECONOMICS,"ECONOMICS, SUPPLYANDDEMAND, SUPPLY, DEMAND, MONEY, INVESTING, TAX, BUSINESS, PRICES"
ECONOMICS OF SOCIAL ISSUES,"ECONOMICS, SUPPLYANDDEMAND, SUPPLY, DEMAND, MONEY, INVESTING, TAX, BUSINESS, PRICES, SOCIAL, SOCIETY"
INTERMEDIATE MICROECONOMIC THEORY,"ECONOMICS, SUPPLYANDDEMAND, SUPPLY, DEMAND, MONEY, INVESTING, TAX, BUSINESS, PRICES"
INTERMEDIATE MACROECONOMIC THEORY,"ECONOMICS, SUPPLYANDDEMAND, SUPPLY, DEMAND, MONEY, INVESTING, TAX, BUSINESS, PRICES"
ENVIRONMENTAL ECONOMICS,"ECONOMICS, SUPPLYANDDEMAND, SUPPLY, DEMAND, MONEY, INVESTING, TAX, BUSINESS, PRICES, ENVIRONMENT, ENVIRONMENTALSTUDIES"
LABOR ECONOMICS,"ECONOMICS, SUPPLYANDDEMAND, SUPPLY, DEMAND, MONEY, INVESTING, TAX, BUSINESS, PRICES, LABOR"
MONEY AND BANKING,"MONEY, BANKING, FINANCE, ECONOMICS, FEDERALRESERVE, CASH, INVESTING, BANKS"
FINANCIAL MARKETS AND INSTITUTIONS,"FINANCE, ECONOMICS, INVESTING, STOCKS, MARKETS, CASH, MONEY, BANKING, BANKS, HEDGEFUNDS, FIRMS"
INTERNATIONAL ECONOMICS,"INTERNATIONALSTUDIES, ECONOMICS, MONEY, GLOBALSTUDIES, WORLDSTUDIES, BANKING"
HISTORY OF ECONOMIC THOUGHT,"ECONOMICS, PHILOSOPHYMONEY, SUPPLYANDDEMAND, SUPPLY, DEMAND, BANKS, PEOPLE"
CONTEMPORARY ECONOMIC ISSUES,"ECONOMICS, PHILOSOPHYMONEY, SUPPLYANDDEMAND, SUPPLY, DEMAND, BANKS, PEOPLE"
FOUNDATIONS OF EDUCATION,"FOUNDATIONAL, EDUCATION, TEACHING, LEARNING, CHILDREN, SCHOOL, TEACHER"
INTRODUCTION TO TEACHING,"FOUNDATIONAL, INTRODUCTORY, EDUCATION, TEACHING, LEARNING, CHILDREN, SCHOOL, TEACHER"
GENRE STUDY,"GENRE, STUDY, BOOKS, READING, WRITING, ENGLISH, SOCIETY, POETRY, POEMS, DRAMA"
SPECIAL TOPICS IN EDUCATION,"FOUNDATIONAL, INTRODUCTORY, EDUCATION, TEACHING, LEARNING, CHILDREN, SCHOOL, TEACHER"
INTERMEDIATE WRITING FOR COLLEGE,"WRITING, INTERMEDIATE, ENGLISH, COLLEGE, BOOKS, LITERATURE, HUMANS, NOVEL, TEACHING, PRESENTATION, ESSAY"
WRITING FOR COLLEGE,"WRITING, INTERMEDIATE, ENGLISH, COLLEGE, BOOKS, LITERATURE, HUMANS, NOVEL, TEACHING, PRESENTATION, ESSAY"
INTRODUCTION TO THEATRE,"WRITING, INTERMEDIATE, ENGLISH, COLLEGE, BOOKS, LITERATURE, HUMANS, NOVEL, TEACHING, PRESENTATION, ESSAY, ACTING, THEATRE"
LITERARY STUDY,"WRITING, INTERMEDIATE, ENGLISH, COLLEGE, BOOKS, LITERATURE, HUMANS, NOVEL, TEACHING, PRESENTATION, ESSAY"
WRITING AS A DISCIPLINE,"WRITING, INTERMEDIATE, ENGLISH, COLLEGE, BOOKS, LITERATURE, HUMANS, NOVEL, TEACHING, PRESENTATION, ESSAY"
ENGLISH AS A FOREIGN LANGUAGE I,"TEACHING, LANGUAGESTUDY, EDUCATION, ENGLISH, FOREIGNLANGUAGE, LANGUAGE"
INTRODUCTION TO LINGUISTICS,"LANGUAGE, WRITING, SPEECH, ENGLISH, WORDS, LANGUAGESTUDY"
ENGLISH AS A FOREIGN LANGUAGE II,"TEACHING, LANGUAGESTUDY, EDUCATION, ENGLISH, FOREIGNLANGUAGE, LANGUAGE"
THE ART OF POETRY,"READING, ENGLISH, LITERATURE, POETRY, STYLE, WRITING, POEMS"
"GRAMMAR, STYLE AND EDITING","GRAMMAR, WRITING, STYLE, ENGLISH, TEACHING, LINGUISTICS, EDITING"
MODERN SPECULATIVE FICTION,"READING, BOOKS, ENGLISH, LITERATURE, MODERN, FICTION, WRITING"
AMERICAN LITERATURE I,"AMERICANSTUDIES, LITERATURE, READING, WRITING, ENGLISH, STYLE, BOOKS"
AMERICAN LITERATURE II,"AMERICANSTUDIES, LITERATURE, READING, WRITING, ENGLISH, STYLE, BOOKS"
ENGLISH LITERATURE I,"AMERICANSTUDIES, LITERATURE, READING, WRITING, ENGLISH, STYLE, BOOKS"
ENGLISH LITERATURE II,"AMERICANSTUDIES, LITERATURE, READING, WRITING, ENGLISH, STYLE, BOOKS"
RELIGIOUS THEMES IN LITERATURE,"RELIGION, SOCIETY, HUMANS, COMMUNITY, CULTURE, HUMANBEHAVIOR, WORLDSTUDIES, INTERNATIONALSTUDIES, CHILDREN, FAMILYSTUDIES, LITERATURE, THEMES, STUDY, BEHAVIOR, WORLDSTUDIES"
LITERATURE AND GENDER,"LITERATURE, BOOKS, READING, WRITING, GENDERSTUDIES, GENDER, ENGLISH, SOCIETY"
THEMES IN SHAKESPEARE,"THEATRE, SHAKESPEARE, THEMES, READING, LITERATURE, ENGLISH"
LITERARY GENRES: DRAMA & POETRY,"LITERATURE, BOOKS, READING, WRITING, ENGLISH, SOCIETY, POETRY, POEMS, DRAMA"
ACTING I,"ACTING, THEATRE, ACTORS, PLAY, SCRIPT, WRITING, SPEAKING"
THEATRE PRACTICUM,"ACTING, THEATRE, ACTORS, PLAY, SCRIPT, WRITING, SPEAKING"
CLASSICS OF WESTERN LITERATURE,"WESTERNSTUDIES, LITERATURE, READING, WRITING, BOOKS, ENGLISH"
LITERARY GENRES: FICTION,"LITERATURE, READING, FICTION, GENRE, ENGLISH, BOOKS, WRITING"
CLASSICS OF WESTERN LITERATURE II,"WESTERNSTUDIES, LITERATURE, READING, WRITING, BOOKS, ENGLISH"
AMERICAN SHORT FICTION,"AMERICANSTUDIES, LITERATURE, READING, WRITING, ENGLISH, STYLE, BOOKS, FICTION, SHORTSTORIES"
ACTING II,"ACTING, THEATRE, ACTORS, PLAY, SCRIPT, WRITING, SPEAKING"
CREATIVE WRITING,"CREATIVITY, WRITING, ENGLISH, LITERATURE, BOOKS, FICTION"
SPECIAL TOPICS IN ENGLISH,"ENGLISH, LITERATURE, BOOKS, HISTORY"
HISTORY OF THE ENGLISH LANGUAGE,"HISTORY, ENGLISH, LINGUISTICS, LANGUAGESTUDY, READING, BOOKS, WRITING, STYLE"
WORLD ENGLISHES,"HISTORY, ENGLISH, LINGUISTICS, LANGUAGESTUDY, READING, BOOKS, WRITING, STYLE"
ITALIAN-AMERICAN EXPERIENCE,"ITALY, AMERICANSTUDIES, AMERICA, WORLDSTUDIES, ENGLISH, READING, LITERATURE"
MEDIA PERFORMANCE,"MEDIA, NEWS, ENGLISH, BROADCAST, PUBLIC, SPEECH"
LITERARY CRITICAL THEORY,"LITERATURE, READING, GENRE, ENGLISH, BOOKS, WRITING, THEORY"
WORKSHOP IN PLAYWRITING,"ACTING, THEATRE, ACTORS, PLAY, SCRIPT, WRITING, SPEAKING"
THE RISE OF THE ENGLISH NOVEL,"ENGLISH, BOOKS, NOVELS, LANGUAGESTUDY, LITERATURE, WRITING, STYLE"
POETRY WORKSHOP,"READING, ENGLISH, LITERATURE, POETRY, STYLE, WRITING, POEMS"
BUSINESS WRITING,"BUSINESS, EXECUTIVESUMMARY, WRITING, ENGLISH"
FORMS IN WRITING,"WRITING, FORMS, ENGLISH, STYLE"
SHAKESPEARE,"THEATRE, SHAKESPEARE, READING, LITERATURE, ENGLISH"
THE MODERN NOVEL IN ENGLISH,"ENGLISH, BOOKS, NOVELS, LANGUAGESTUDY, LITERATURE, WRITING, STYLE, MODERN"
MODERN ENGLISH AND AMERICAN POETRY,"READING, ENGLISH, LITERATURE, POETRY, STYLE, WRITING, POEMS, MODERN"
SEVENTEENTH-CENTURY LITERATURE,"LITERATURE, READING, GENRE, ENGLISH, BOOKS, WRITING, OLDLITERATURE"
AMERICAN DRAMA I,"AMERICANSTUDIES, DRAMA, LITERATURE, THEATRE, WRITING, SCRIPTS"
MEDIEVAL LITERATURE,"LITERATURE, READING, GENRE, ENGLISH, BOOKS, WRITING, OLDLITERATURE, MEDIEVAL"
RENAISSANCE LITERATURE,"LITERATURE, READING, GENRE, ENGLISH, BOOKS, WRITING, OLDLITERATURE, RENAISSANCE"
THE ROMANTICS,"LOVE, READING, BOOKS, DRAMA, LITERATURE, THEATRE, WRITING, SCRIPTS"
VICTORIAN PROSE AND POETRY,"POEMS, POETRY, LITERATURE, BOOKS, ENGLISH, OLDLITERATURE, WRITING"
FILM AND LITERATURE,"FILMSTUDIES, FILM, MOVIES, LITERATURE, ENGLISH, WRITING, BOOKS"
AMERICAN DRAMA II,"AMERICANSTUDIES, DRAMA, LITERATURE, THEATRE, WRITING, SCRIPTS"
MODERN IRISH LITERATURE,"LITERATURE, READING, GENRE, ENGLISH, BOOKS, WRITING, MODERN, IRISH"
AMERICAN RENAISSANCE,"LITERATURE, READING, GENRE, ENGLISH, BOOKS, WRITING, OLDLITERATURE, RENAISSANCE, AMERICANSTUDIES"
AMERICAN REALISTS AND NATURALISTS,"LITERATURE, READING, GENRE, ENGLISH, BOOKS, WRITING, OLDLITERATURE, RENAISSANCE, AMERICANSTUDIES"
AMERICAN MODERNISM,"AMERICANSTUDIES, LITERATURE, THEATRE, WRITING, MODERN, BOOKS"
ACTING III,"ACTING, THEATRE, ACTORS, PLAY, SCRIPT, WRITING, SPEAKING"
BRITISH MODERNISM,"BRITISH, EASTERNSTUDIES, LITERATURE, THEATRE, ENGLISH, WRITING, MODERN, BOOKS"
THE HISTORY OF THE MODERN THEATRE,"ACTING, THEATRE, ACTORS, PLAY, SCRIPT, WRITING, SPEAKING, MODERN, HISTORY"
DIRECTING,"ACTING, THEATRE, ACTORS, PLAY, SCRIPT, WRITING, SPEAKING, DIRECTING, MOVIES, FILM"
ANCIENT GREEK LITERATURE,"LITERATURE, READING, GENRE, ENGLISH, BOOKS, WRITING, OLDLITERATURE, GREECE, OLDLITERATURE, EASTERNSTUDIES"
COMPOSITION THEORY,"THEORY, WRITING, ENGLISH, LITERATURE, BOOKS, COMPOSITION"
TECHNICAL WRITING,"WRITING, FORMS, ENGLISH, STYLE, TECHNICAL"
MODERN DRAMA,"DRAMA, LITERATURE, THEATRE, WRITING, SCRIPTS, MODERN"
MODERN JEWISH LITERATURE,"EASTERNSTUDIES, LITERATURE, THEATRE, ENGLISH, WRITING, MODERN, BOOKS, RELIGIOUS"
ETHNIC AMERICAN LITERATURE,"AMERICANSTUDIES, LITERATURE, READING, CULTURE, WORLDSTUDIES, SOCIETY, ENGLISH"
JUNIOR/SENIOR RESEARCH SEMINAR,"JUNIOR, SENIOR, RESEARCH, SEMINAR"
LITERATURE OF THE HOLOCAUST,"LITERATURE, HISTORY, WORLDHISTORY, WRITNG, READING, BOOKS, JUDAISM"
WORKSHOP IN FICTION,"FICTION, BOOKS, WORKSHOP, ENGLISH, LITERATURE, READING"
SEMINAR IN AMERICAN LITERATURE,"SEMINAR, AMERICANSTUDIES, LITERATURE, BOOKS, WRITING, THEMES, STUDY, ENGLISH"
THEATRE WORKSHOP,"ACTING, THEATRE, ACTORS, PLAY, SCRIPT, WRITING, SPEAKING, WORKSHOP"
ADVANCED SCREENWRITING,"ACTING, THEATRE, ACTORS, PLAY, SCRIPT, WRITING, SPEAKING, WORKSHOP, ADVANCED"
SEMINAR IN ENGLISH LITERATURE,"SEMINAR, LITERATURE, BOOKS, WRITING, THEMES, STUDY, ENGLISH, CHARACTER"
INTRODUCTION TO GEOLOGY LABORATORY,"INTRODUCTORY, ENGLISH, LAB, GEOLOGY, ROCKS, CRUST, EARTH, STONES, SCIENCE, EARTHSCIENCE"
ENVIRONMENTAL ECONOMICS,"ECONOMICS, SUPPLYANDDEMAND, SUPPLY, DEMAND, MONEY, INVESTING, TAX, BUSINESS, PRICES, ENVIRONMENT, ENVIRONMENTALSTUDIES"
FIELD AND LAB EXPERIENCE,"LAB, ENVIRONMENTAL, SCIENCE, FIELDWORK, INPERSON, INFIELD. EXPERIENCE"
ENVIRONMENTAL POLITICS AND POLICY,"ENVIRONMENT, POLICY, POLITICS, PUBLICHEALTH, SOCIETY, NATURE, PUBLICPOLICY"
ENVIRONMENTAL HEALTH,"HEALTH, ENVIRONMENT, PUBLICHEALTH, NATURE, HUMANS, PEOPLE, SOCIETY"
INTRODUCTION TO GEOLOGY,"INTRODUCTORY, ENGLISH, GEOLOGY, ROCKS, CRUST, EARTH, STONES, SCIENCE, EARTHSCIENCE"
ENVIRONMENTAL CHEMISTRY LABORATORY,"ENVIRONMENT, SCIENCE, LAB, CHEMISTRY, ENVIRONMENTALSCIENCE, NATURE, SOCIETY"
EPIDEMIOLOGY,"DISEASE, HEALTH, PUBLICHEALTH, SCIENCE, ENVIRONMENTALSCIENCE, ENVIRONMENT, COMMUNITY, SOCIETY, HUMANS, PEOPLE"
ENVIRONMENTAL CHEMISTRY,"ENVIRONMENT, SCIENCE, CHEMISTRY, ENVIRONMENTALSCIENCE, NATURE, SOCIETY"
ENVIRONMENTAL MICROBIOLOGY,"ENVIRONMENT, SCIENCE, CHEMISTRY, ENVIRONMENTALSCIENCE, NATURE, SOCIETY, BIOLOGY, MICROBIOLOGY"
ECOLOGY: PRINCIPLES & PRACTICE,"PRINCIPLES, ECOLOGY, ECOSYSTEM, NATURE, ENVIRONMENT, PRACTICE, ENVIRONMENTALSCIENCE"
FRESHWATER ECOLOGY,"FRESHWATER, FISH, WATER, ECOSYSTEM, NATURE, ENVIRONMENTALSCIENCE, SCIENCE, ENVIRONMENT, ECOLOGY"
ENVIRONMENTAL TOXICOLOGY,"ENVIRONMENT, SCIENCE, ENVIRONMENTALSCIENCE, NATURE, SOCIETY, CHEMICALS, TOXINS, SUBSTANCES, PEOPLE"
ENVIRONMENTAL PLANNING,"ENVIRONMENT, SCIENCE, ENVIRONMENTALSCIENCE, NATURE, SOCIETY, PLANNING"
ENVIRONMENTAL LAW,"ENVIRONMENT, SCIENCE, ENVIRONMENTALSCIENCE, NATURE, SOCIETY, LAW, RULES, REGULATIONSS"
FASHION IN CULTURE & COMMERCE,"FASHION, CULTURE, COMMERCE, MARKETS, MONEY, SOCIETY, PEOPLE, STYLE, CREATIVITY"
CREATIVE PROCESS,"CREATIVITY, PROCESS, ART, FASHION, DESIGN"
FASHION FIGURE DRAWING,"FASHION, DRAWING, DESIGN, FASHIONDESIGN, SOCIETY, PEOPLE, STYLE, CREATIVITY, ART"
FASHION FIGURE DRAWING II,"FASHION, DRAWING, DESIGN, FASHIONDESIGN, SOCIETY, PEOPLE, STYLE, CREATIVITY, ART"
FASHION FIGURE DRAWING III,"FASHION, DRAWING, DESIGN, FASHIONDESIGN, SOCIETY, PEOPLE, STYLE, CREATIVITY, ART"
FASHION FIGURE DRAWING IV,"FASHION, DRAWING, DESIGN, FASHIONDESIGN, SOCIETY, PEOPLE, STYLE, CREATIVITY, ART"
FASHION DESIGN I: DRAWING & COLOR,"FASHION, DRAWING, DESIGN, FASHIONDESIGN, SOCIETY, PEOPLE, STYLE, CREATIVITY, ART"
TEXTILES: STUDIES & APPLICATIONS,"FASHION, DRAWING, DESIGN, FASHIONDESIGN, SOCIETY, PEOPLE, STYLE, CREATIVITY, ART"
DESIGN STUDIO TECHNIQUES,"FASHION, DRAWING, DESIGN, FASHIONDESIGN, SOCIETY, PEOPLE, STYLE, CREATIVITY, ART"
APPAREL DEVELOPMENT I,"FASHION, DRAWING, DESIGN, FASHIONDESIGN, SOCIETY, PEOPLE, STYLE, CREATIVITY, ART"
APPAREL DEVELOPMENT II,"FASHION, DRAWING, DESIGN, FASHIONDESIGN, SOCIETY, PEOPLE, STYLE, CREATIVITY, ART"
FASHION DESIGN II: PRESENTATION,"FASHION, DRAWING, DESIGN, FASHIONDESIGN, SOCIETY, PEOPLE, STYLE, CREATIVITY, ART"
DIGITAL FASHION DESIGN I,"FASHION, DRAWING, DESIGN, FASHIONDESIGN, SOCIETY, PEOPLE, STYLE, CREATIVITY, ART, DIGITALDESIGN, DIGITAL"
WRITING FOR FASHION,"FASHION, DRAWING, WRITING, DESIGN, FASHIONDESIGN, SOCIETY, PEOPLE, STYLE, CREATIVITY, ART"
TEXTILE DESIGN,"FASHION, DRAWING, DESIGN, FASHIONDESIGN, SOCIETY, PEOPLE, STYLE, CREATIVITY, ART"
DIGITAL FASHION DESIGN II,"FASHION, DRAWING, DESIGN, FASHIONDESIGN, SOCIETY, PEOPLE, STYLE, CREATIVITY, ART, DIGITALDESIGN, DIGITAL"
VISUAL MERCHANDISING,"VISUAL, MERCHANDISE, MARKETS, FASHION, DESIGN, STYLE, PEOPLE, ART, SOCIETY"
EVENT PLANNING,"EVENTPLANNING, EVENTS, PUBLIC, PEOPLE, COMMUNICATIONS, HUMANS, FASHION"
FASHION SHOW PRODUCTION,"FASHION, SHOWS, PUBLIC, DESIGN, ART, PLANNING, EVENT"
PRODUCT DEVELOPMENT,"PRODUCT, DEVELOPMENT, ART, MARKETS, DESIGN, TESTING, SAFETY, BUSINESS"
PRIVATE LABEL DEVELOPMENT,"PRODUCT, DEVELOPMENT, ART, MARKETS, DESIGN, TESTING, SAFETY, BUSINESS"
FASHION BRANDING & LICENSING,"PRODUCT, DEVELOPMENT, ART, MARKETS, DESIGN, TESTING, SAFETY, BUSINESS, BRANDS, BRANDING, LICENSING"
MERCHANDISE PLANNING & CONTROL,"MERCHANDISE, MARKETS, FASHION, DESIGN, STYLE, PEOPLE, ART, SOCIETY, PLANNING"
SUSTAINABILITY IN FASHION,"SUSTAINABILITY, FASHION, ENVIRONMENT, SCIENCE, NATURE, POLUTION"
"BUYING, PLANNING & ALLOCATION","MERCHANDISE, MARKETS, FASHION, DESIGN, STYLE, PEOPLE, ART, SOCIETY, PLANNING"
APPAREL DEVELOPMENT III,"FASHION, DRAWING, DESIGN, FASHIONDESIGN, SOCIETY, PEOPLE, STYLE, CREATIVITY, ART"
RETAIL ENTREPRENEURSHIP I,"PRODUCT, DEVELOPMENT, ART, MARKETS, DESIGN, TESTING, SAFETY, BUSINESS, RETAIL, ENTREPRENEURSHIP"
APPAREL SUPPLY CHAIN MANAGEMENT,"FASHION, DRAWING, DESIGN, FASHIONDESIGN, SOCIETY, PEOPLE, STYLE, CREATIVITY, ART, MANAGMENT, BUSINESS, SUPPLYCHAIN"
ADVANCED FASHION SHOW PRODUCTION,"FASHION, SHOWS, PUBLIC, DESIGN, ART, PLANNING, EVENT"
KNITWEAR DESIGN,"FASHION, DRAWING, DESIGN, FASHIONDESIGN, SOCIETY, PEOPLE, STYLE, CREATIVITY, ART, KNITWEAR"
HISTORY OF MODERN FASHION,"MODERN, FASHION, HISTORY, ART, DESIGN, FASHIONDESIGN, MODERNHISTORY"
EMPLOYMENT SEMINAR,"SEMINAR, EMPLOYMENT, PERSONALGROWTH, CAREERDEVELOPMENT"
GLOBAL MERCHANDISING STRATEGIES,"GLOBAL, MERCHANDISE, MARKETS, STRATEGIES, FASHION "
FASHION MERCHANDISING CAPPING,"GLOBAL, MERCHANDISE, MARKETS, STRATEGIES, FASHION, CAPPING"
ELEMENTARY FRENCH I,"FRENCH, LANGUAGESTUDY, INTRODUCTORY"
ELEMENTARY FRENCH II,"FRENCH, LANGUAGESTUDY, INTRODUCTORY"
INTERMEDIATE FRENCH I,"FRENCH, LANGUAGESTUDY"
INTERMEDIATE FRENCH II,"FRENCH, LANGUAGESTUDY"
FRANCE AND THE WORLD,"FRANCE, FRENCH, WORLDSTUDIES, GLOBALSTUDIES, HISTORY, LANGUAGESTUDY"
WORKSHOP IN WRITING,"WRITING, WORKSHOPS, ENGLISH"
WORKSHOP IN ORAL EXPRESSION,"WORKSHOPS, ENGLISH, SPEECH, ORAL"
LANGUAGE AND TECHNOLOGY PRACTICUM,"LANGUAGE, TECHNOLOGY, PRACTICAL, SPEECH"
FRENCH CULTURE & THOUGHT:,"FRENCH, FRANCE, CULTURE, WORLDSTUDIES"
CONTEMPORARY FRANCE,"FRENCH, FRANCE, WORLDSTUDIES, CULTURE"
INTERNSHIP IN FRENCH,"FRENCH, INTERNSHIP"
FRENCH FOR CURRENT AFFAIRS,"FRENCH, WORLDSTUDIES, CULTURE"
CAPPING COURSE,"FRENCH, SENIOR, CAPPING, LANGUAGESTUDY, PROJECT"
INTRODUCTION TO GAMES,"INTRODUCTORY, GAMES, GAMEDESIGN, MEDIA, DIGITALMEDIA"
COLLOQUIUM IN GAMES,"GAMES, GAMEDESIGN, MEDIA, DIGITALMEDIA"
LAB PRACTICUM,"GAMES, GAMEDESIGN, MEDIA, DIGITALMEDIA, LAB"
THE BUSINESS OF GAMES,"GAMES, GAMEDESIGN, MEDIA, DIGITALMEDIA, BUSINESS"
INDEPENDENT STUDY,"GAMES, GAMEDESIGN, MEDIA, DIGITALMEDIA"
HUMAN-COMPUTER INTERACTION,"GAMES, GAMEDESIGN, MEDIA, DIGITALMEDIA, HUMANS, HUMANBEHAVIOR, COMPUTER, COMPUTINGTECHNOLOGY"
GAME STUDIO,"GAMES, GAMEDESIGN, MEDIA, DIGITALMEDIA"
CAPPING,"GAME, GAMEDESIGN, CAPPING, MEDIA, DIGITALMEDIA, DESIGN, CAPPING, SENIOR, PROJECT"
GAME INTERNSHIP,"GAMES, GAMEDESIGN, MEDIA, DIGITALMEDIA, INTERNSHIP"
ADVANCED GAME INTERNSHIP,"GAMES, GAMEDESIGN, MEDIA, DIGITALMEDIA, INTERNSHIP, ADVANCED"
ELEMENTARY GERMAN I,"GERMAN, ELEMENTARY, INTRODUCTORY, LANGUAGESTUDY, FOREIGNLANGAUGE, SPEAKING"
ELEMENTARY GERMAN II,"GERMAN, ELEMENTARY, INTRODUCTORY, LANGUAGESTUDY, FOREIGNLANGAUGE, SPEAKING"
INTERMEDIATE GERMAN I,"GERMAN, LANGUAGESTUDY, FOREIGNLANGAUGE, SPEAKING"
INTERMEDIATE GERMAN II,"GERMAN, LANGUAGESTUDY, FOREIGNLANGAUGE, SPEAKING"
GERMAN LANGUAGE AND CULTURE I,"GERMAN, LANGUAGESTUDY, FOREIGNLANGAUGE, SPEAKING, CULTURE"
GERMAN LANGUAGE AND CULTURE II,"GERMAN, LANGUAGESTUDY, FOREIGNLANGAUGE, SPEAKING, CULTURE"
GREEK DRAMA,"DRAMA, GREECE, BACKGROUND, LITERATURE, THEATRE, HUMANSTUDIES, PROGRESS, CIVILIZATION, CHARACTER"
GREEK MYTHOLOGY,"MYTHOLOGY, ANCIENT, GREECE, GODS, PANTHEON, BACKGROUND, HISTORY, HUMANSTUDIES, CIVILIZATION"
SPECIAL TOPICS I,"BACKGROUND, PRINCIPLE, RELATIVE, PROGRESS, STATUS, PEACE, MISSION, BORDER, PUBLIC, HUMAN, NATIONAL, INTERNATIONAL, CONFLICT, ABROAD, LEADERSHIP, GLOBAL, SPECIALTOPICS"
SPECIAL TOPICS II,"LITERATURE, GOLDENAGE, WRITING, HISTORY, ART, CULTURE, CHARACTER, NOVEL"
INTRODUCTION TO GLOBAL ISSUES,"BACKGROUND, PRINCIPLE, RELATIVE, PROGRESS, STATUS, PEACE,  MISSION, BORDER, PUBLIC, HUMAN, NATIONAL, INTERNATIONAL, CONFLICT, ABROAD, LEADERSHIP, GLOBAL, INTRODUCTORY, ISSUES"
HUMAN NUTRITION,"HUMAN, SICK, ADULT, FEED, REPORT, ACTIVE, COOK, MOVE, MONITOR, DIET, STOMACH, PATIENT, STRENGTH, MUSCLE, WEIGHT, NUTRITION, HEALTH"
FIRST AID/CPR,"HUMAN, RECOVER, SWIM, HURT, SICK, ADULT, REPORT, BREAK, MOVE, HELP, NURSE, MONITOR, STOMACH, PATIENT, BABY, SAVE, PRACTICE, HUMANBODY, CPR, HEALTH"
SPECIAL TOPICS I,"HUMAN, SICK, ADULT, FEED, REPORT, ACTIVE, COOK, MOVE, MONITOR, DIET, STOMACH, PATIENT, STRENGTH, MUSCLE, WEIGHT, NUTRITION, HEALTH"
SPECIAL TOPICS II,"HUMAN, NUTRITION, HUMANBODY, SPECIALTOPICS, TWIST, RECOVER, TRAIN, SWIM, STRAIN, HURT, SICK, SCRATCH, ADULT, FEED, REPORT, BREAK, ACTIVE, RUN, COOK, MOVE, HELP, HARM, PACE, NURSE, MONITOR, DIET, ARM, STOMACH, SMOKE, PATIENT, BONE, STRENGTH, MUSCLE, JOINT, WEIGHT, SKIN, BABY, EXERCISE"
PERSONAL AND COMMUNITY HEALTH,"HUMAN, NUTRITION, HUMANBODY, SPECIALTOPICS, TWIST, RECOVER, TRAIN, SWIM, STRAIN, HURT, SICK, SCRATCH, ADULT, FEED, REPORT, BREAK, ACTIVE, RUN, COOK, MOVE, HELP, HARM, PACE, NURSE, MONITOR, DIET, ARM, STOMACH, SMOKE, PATIENT,BONE, STRENGTH, MUSCLE, JOINT, WEIGHT, SKIN, BABY, EXERCISE"
INTERNSHIP IN GLOBAL STUDIES,"BACKGROUND, PRINCIPLE, RELATIVE, PROGRESS, STATUS, PEACE,  MISSION, BORDER, PUBLIC, HUMAN, NATIONAL, INTERNATIONAL, CONFLICT, ABROAD, LEADERSHIP, GLOBAL, WORLDSTUDIES, INTERNSHIP"
SPORT AND EXERCISE PSYCHOLOGY,"JESUS, DISCIPLESHIP, FAITH, RELIGION, CHRISTIANITY"
INTRODUCTION TO PUBLIC HISTORY,"HISTORY, LETTER, EVIDENCE, BACKGROUND, CHART, PRINCIPLE, PROGRESS, STATUS, DREAM,ESSAY, PEACE, CONSIDERATION, DETAIL, INTERVIEW, "
TOPICS IN NUTRITION,"HUMAN, SICK, ADULT, FEED, REPORT, ACTIVE, COOK, MOVE, MONITOR, DIET, STOMACH, PATIENT, STRENGTH, MUSCLE, WEIGHT, NUTRITION, HEALTH"
AFGHANISTAN AND ITS WARS,"HISTORY, BATTLE, FIGHT, BORDER, HUMAN, NATIONAL, CONFLICT, ATTACK, WAR"
KINESIOLOGY,"HUMAN, RECOVER, HURT, SICK, ADULT, REPORT, MOVE, HELP, NURSE, MONITOR, PATIENT, PRACTICE, HUMANBODY, HEALTH"
HISTORY OF THE HOLOCAUST,"HISTORY, WAR, INTERNATIONAL, HURT, HUMANS"
EXERCISE PHYSIOLOGY,"HUMAN, RECOVER, HURT, SICK, ADULT, REPORT, MOVE, HELP, NURSE, MONITOR, PATIENT, PRACTICE, HUMANBODY, HEALTH"
THEMES IN MODERN HISTORY,"HISTORY, LETTER, EVIDENCE, BACKGROUND, CHART, PRINCIPLE, PROGRESS, STATUS, DREAM, ESSAY, PEACE, CONSIDERATION, DETAIL, INTERVIEW, MODERN"
INTRODUCTION TO WOMENS STUDIES,"WOMEN, HUMANS, BACKGROUND, CHART, PRINCIPLE, STATUS, DREAM, ESSAY, PEACE, CONSIDERATION, DETAIL, INTERVIEW, WOMENSTUDIES, SEX, PROGRESS"
"POLITICAL, BLACKHISTORY, HISTORY, LETTER, EVIDENCE, BACKGROUND, CHART, PRINCIPLE, STATUS, DREAM,ESSAY, PEACE, CONSIDERATION, DETAIL, INTERVIEW, HUMANSTUDIES, RACE, PROGRESS, SOCIAL","POLITICAL, BLACKHISTORY, HISTORY, LETTER, EVIDENCE, BACKGROUND, CHART, PRINCIPLE, STATUS, DREAM, ESSAY, PEACE, CONSIDERATION, DETAIL, INTERVIEW, HUMANSTUDIES, RACE, PROGRESS, SOCIAL"
CATHOLICS IN THE U.S.,"AMERICANSTUDIES, CATHOLIC, EVIDENCE, BACKGROUND, CHART, PRINCIPLE, STATUS, DREAM,ESSAY, PEACE, CONSIDERATION, DETAIL, INTERVIEW, HUMANSTUDIES, RELIGION, PROGRESS, SOCIAL"
NEW YORK: THE EMPIRE STATE,"AMERICANSTUDIES, HISTORY, EVIDENCE, BACKGROUND, CHART, PRINCIPLE, STATUS, DREAM, ESSAY, PEACE, CONSIDERATION, DETAIL, INTERVIEW, HUMANSTUDIES, PROGRESS, SOCIAL, NEWYORK"
CONTINUITY AND CHANGE IN WARFARE,"HISTORY, BATTLE, FIGHT, BORDER, HUMAN, NATIONAL, CONFLICT, ATTACK, WAR, CHANGE"
ANCIENT GREECE,"HISTORY, GREECE, EVIDENCE, BACKGROUND, STATUS, ESSAY, PEACE, CONSIDERATION, DETAIL, HUMANSTUDIES, PROGRESS, CIVILIZATION"
ANCIENT ROME,"HISTORY, ROME, EVIDENCE, BACKGROUND, STATUS, ESSAY, PEACE, CONSIDERATION, DETAIL, HUMANSTUDIES, PROGRESS, CIVILIZATION"
MEDIEVAL EUROPE,"HISTORY, EUROPE, MEDIEVAL, EVIDENCE, BACKGROUND, STATUS, ESSAY, PEACE, CONSIDERATION, DETAIL, HUMANSTUDIES, PROGRESS, CIVILIZATION"
EARLY MODERN EUROPE,"HISTORY, MODERN, EUROPE, EVIDENCE, BACKGROUND, STATUS, ESSAY, PEACE, CONSIDERATION, DETAIL, HUMANSTUDIES, PROGRESS, CIVILIZATION"
U.S. WOMENS HISTORY,"HISTORY, AMERICANSTUDIES, WOMEN, BACKGROUND, CHART, PRINCIPLE, STATUS, DREAM, ESSAY, PEACE, CONSIDERATION, DETAIL, INTERVIEW, WOMENSTUDIES, SEX, PROGRESS"
CATHOLIC CHURCH IN MODERN TIMES,"MODERN, CATHOLIC, HISTORY, CHURCH, BACKGROUND, PRINCIPLE, STATUS, ESSAY, CONSIDERATION, DETAIL, INTERVIEW, HUMANSTUDIES, RELIGION, PROGRESS"
AFRICAN AMERICAN HISTORY,"AFRICANAMERICAN, HISTORY, EVIDENCE, BACKGROUND, CHART, PRINCIPLE, STATUS, DREAM, ESSAY, PEACE, CONSIDERATION, DETAIL, INTERVIEW, HUMANSTUDIES, RACE, PROGRESS, SOCIAL"
MODERN EUROPE,"HISTORY, EUROPE, MODERN, EVIDENCE, BACKGROUND, STATUS, ESSAY, PEACE, CONSIDERATION, DETAIL, HUMANSTUDIES, PROGRESS, CIVILIZATION"
THE ANCIENT EAST,"HISTORY, EAST, ANCIENT, EVIDENCE, BACKGROUND, STATUS, ESSAY, PEACE, CONSIDERATION, DETAIL, HUMANSTUDIES, PROGRESS, CIVILIZATION"
COLONIAL LATIN AMERICA,"HISTORY, COLONIAL, LATINAMERICA, EVIDENCE, BACKGROUND, STATUS, ESSAY, PEACE, CONSIDERATION, DETAIL, HUMANSTUDIES, PROGRESS, CIVILIZATION"
MODERN LATIN AMERICA,"HISTORY, MODERN, LATINAMERICA, EVIDENCE, BACKGROUND, STATUS, ESSAY, PEACE, CONSIDERATION, DETAIL, HUMANSTUDIES, PROGRESS, CIVILIZATION"
ITALIAN-AMERICAN EXPERIENCE,"HISTORY, ITALIANAMERICAN, EXPERIENCE, AMERICANHISTORY, BACKGROUND, STATUS, ESSAY, PEACE, CONSIDERATION, DETAIL, HUMANSTUDIES, PROGRESS, CIVILIZATION"
MODERN AFRICA,"HISTORY, MODERN, AFRICA, EVIDENCE, BACKGROUND, STATUS, ESSAY, PEACE, CONSIDERATION, DETAIL, HUMANSTUDIES, PROGRESS, CIVILIZATION"
WOMEN IN ASIA,"HISTORY, WOMEN, ASIA, EVIDENCE, BACKGROUND, STATUS, ESSAY, PEACE, CONSIDERATION, DETAIL, HUMANSTUDIES, PROGRESS, CIVILIZATION, CHART, PRINCIPLE, WOMENSTUDIES, SEX"
TRADITIONAL ASIA,"HISTORY, TRADITIONAL, ASIA, EVIDENCE, BACKGROUND, STATUS, ESSAY, PEACE, CONSIDERATION, DETAIL, HUMANSTUDIES, PROGRESS, CIVILIZATION"
MODERN ASIA,"HISTORY, MODERN, ASIA, EVIDENCE, BACKGROUND, STATUS, ESSAY, PEACE, CONSIDERATION, DETAIL, HUMANSTUDIES, PROGRESS, CIVILIZATION"
TRADITIONAL CHINA,"HISTORY, TRADITIONAL, CHINA, EVIDENCE, BACKGROUND, STATUS, ESSAY, PEACE, CONSIDERATION, DETAIL, HUMANSTUDIES, PROGRESS, CIVILIZATION"
MODERN CHINA,"HISTORY, MODERN, ASIA, EVIDENCE, BACKGROUND, STATUS, ESSAY, PEACE, CONSIDERATION, DETAIL, HUMANSTUDIES, PROGRESS, CIVILIZATION"
