CLASS_NAME,TAGS
Catholic Thought and Spirituality,"CatholicThought, Spirituality, Religion, Faith, HumanBehavior"
"Prison, Praxis and Prisoners","Prison, Praxis, Prisoners, Government, Society, Humans, HumanBehavior "
Global Liberation Theology,"Global, Liberation, Theology, MarginalizedCommunities, EconomicEquality"
Public Praxis I,"Public, Praxis, PublicLife, SocialDisintegration"
Public Praxis II,"Public, Praxis, PublicLife, SocialDisintegration"
Philosophy of Religion,"Philosophy, Religion, HumanBehavior, CriticalThinking"
Psychology and Religion,"Psychology, Religion, HumanBehavior, CriticalThinking, ScientificStudy"
Spirituality and Human Development,"Spirituality, Humans, Development, HumanBehavior"
Capping Course,"Capping, SeniorYear"
Introduction to Social Work,"Introductory, SocialWork, Society"
Domestic Violence Prevention,"DomesticViolence, Prevention, SocialWork"
Social Service: Theory & Practice,"SocialService, Theory, Practice, SocialWork, Humans, Society"
Alcoholism and the Family,"Alcoholism, Family, SocialWork"
Social-service population.,"SocialService, Population, Practice, SocialWork, Humans, Society"
Addictions and Diverse Populations,"Addictions, DiversePopulations, SocialWork, Humans"
Junior Field Education,"JuniorFieldEducation, FieldExperience, Experience, SocialWork"
Social Work Methods I,"SocialWork, Methods"
Social Work Methods II,"SocialWork, Methods"
Senior Integrative Seminar/Capping,"SocialWork, Methods"
Social Change,"SocialChange, SocialWork, Humans, HumanBehavior, Society"
Introduction to Sociology,"Introductory, Sociology, HumanBehavior, Community, Society, Humans"
Social Problems,"SocialProblems, SocialWork, Humans, HumanBehavior, Society"
Social Deviance,"SocialDeviance, SocialWork, Humans, HumanBehavior, Society"
Sociology of Religion,"ReligiousSociology, Religion, Sociology, HumanBehavior, Community, Society, Humans"
Juvenile Delinquency,"JuvenileDelinquency, SocialWork, Sociology, HumanBehavior, Community, Society, Humans"
Sociology of Community,"CommunitySociology, Sociology, HumanBehavior, Community, Society, Humans"
Sociology of Education,"EducationSociology, Education, Sociology, HumanBehavior, Community, Society, Humans"
Popular Culture,"PopularCulture, Society, Trends, Community, HumanBehavior, Humans"
Special Topics in Sociology I,"SpecialTopics, Sociology, HumanBehavior "
Special Topics in Sociology II,"SpecialTopics, Sociology, HumanBehavior"
Social Inequality,"SocialInequality, Inequality, SocialWork, Community, Society, Humans"
Social Theory,"SocialTheory, Theory, SocialWork, Community, Society, Humans"
Social Research Methods,"Social, Research, Methods, Theory, Resources, Humans, Society"
Elementary Spanish I,"Elementary, Spanish, Language"
Elementary Spanish II,"Elementary, Spanish, Language"
Intermediate Spanish I,"Intermediate, Spanish, Language"
Intermediate Spanish II,"Intermediate, Spanish, Language"
Cultures of Spain,"Culture, Spain, Society, Community"
Cultures of Latin America,"Culture, LatinAmerica, Society, Community"
Cultures of the Hispanic Caribbean,"Culture, HispanicCaribbean, Hispanic, Society, Community"
Spanish: Fiction and Expression,"Spanish, Fiction, Expression, Literature, Writing, Character, Novel"
Spanish for Heritage Speakers I,"HeritageSpeakers, Spanish, Language"
Spanish for Heritage Speakers II,"HeritageSpeakers, Spanish, Language"
Spanish in a Digital Age,"Spanish, Fiction, Expression, Literature, Writing, Character, Novel"
Themes in Spanish Cinema,"Themes, SpanishCinema, Film, Theory, Concepts, Art"
Spanish Study Tour,"Spanish, StudyTour, Guide, Language, Culture"
Spain Today,"Spain, Today, Modern, Current, Society, Community"
Advanced Intensive Spanish I,"Advanced, Intensive, Spanish, Language"
Advanced Intensive Spanish II,"Advanced, Intensive, Spanish, Language"
Latin American Women Writers,"LatinAmerica, Women, Writers, Literature, Poems, Art, Character"
Professional Spanish,"Professional, Spanish, Language"
Special Topics in Spanish I,"SpecialTopics, Spanish, Language, Culture, Art"
Special Topics in Spanish II,"SpecialTopics, Spanish, Language, Culture, Art"
Internship in Spanish,"Internship, Spanish, Language, Culture, Art"
Spanish Composition I,"Spanish, Composition, Language"
Spanish Composition II,"Spanish, Composition, Language"
Spanish Translation Techniques,"Spanish, Translation, Techniques, Strategy, Language"
Spanish American Literature I,"SpanishAmerican, Literature, Writing, Art, Character, Novel"
Spanish American Literature II,"SpanishAmerican, Literature, Writing, Art, Character, Novel"
Capping Course,"Capping, SeniorYear, Spanish"
Medieval Spanish Literature,"Medieval, Spanish, Literature, Writing, History, Art, Culture, Character, Novel"
Contemporary Spanish Literature,"Contemporary, Spanish, Literature, Writing, History, Art, Culture, Character, Novel"
Advanced Internship in Spanish,"Advanced, Internship, Spanish, Language, Culture, History, Art"
Introduction to Women's Studies,"Introductory, Women, Studies, Sex, Humans"
Gender and Media,"Gender, Media, Sex, Humans, HumanBehavior, Society"
Literature of the Golden Age,"Literature, GoldenAge, Writing, History, Art, Culture, Character"
