CLASS_NAME,TAGS
Irish Experience in America,"History, Irish, Experience, AmericanHistory, Background, Status, Essay, Peace, Consideration, Detail, HumanStudies, Progress, Civilization"
Patterns of Immigration,"History, Immigration, Experience, International, Background, Status, Chart, Essay, Peace, Consideration, Detail, HumanStudies, Progress, Civilization, Move"
History of American Manhood,"History, Manhood, Experience, AmericanHistory, Background, Status, Essay, Peace, Consideration, Detail, HumanStudies, Progress, Sex"
Rock 'n Roll as U.S. History,"History, RockAndRoll, Experience, AmericanHistory, US, Background, Status, Essay, Peace, Consideration, Detail, HumanStudies, Progress, Music"
American Colonial Experience,"History, Colonial, Experience, AmericanHistory, Background, Status, Essay, Peace, Consideration, Detail, HumanStudies, Progress, Civilization"
American Revolution,"History, AmericanHistory, Battle, Fight, Human, National, Conflict, Attack, War, Change, Revolution"
American Diplomatic History,"History, Diplomatic, Experience, AmericanHistory, Background, Status, Essay, Peace, Consideration, Detail, HumanStudies, Progress, Civilization"
History of American Feminism,"History, Feminism, Experience, AmericanHistory, Background, Status, Essay, Peace, Consideration, Detail, HumanStudies, Progress, Women, Sex"
Women and Religion in America,"History, Women, Religion, Experience, AmericanHistory, Background, Status, Essay, Peace, Consideration, Detail, HumanStudies, Progress, Sex"
The Vietnam War,"History, War, Vietnam, AmericanHistory, Battle, Fight, Human, National, Conflict, Attack, Change"
"Sex, Disease, and Death in America","History, Sex, Disease, Death, Experience, AmericanHistory, Background, Status, Essay, Peace, Consideration, Detail, HumanStudies, Progress"
History of the American Presidency,"History, Presidency, Experience, AmericanHistory, Background, Status, Essay, Peace, Consideration, Detail, HumanStudies, Progress, Political"
French Revolution and Napoleon,"History, French, Revolution, napolean, Battle, Fight, Human, National, Conflict, Attack, War, Change"
Drug Trade in Asia,"History, Drug, Trade, Asia, Experience, Background, Status, Essay, Consideration, Detail, HumanStudies, International"
Civil War and Reconstruction,"History, AmericanHistory, CivilWar, Battle, Fight, Human, Internal, Conflict, Attack, War, Change, Reconstruction"
Race in Latin American History,"History, Race, LatinAmerica, Evidence, Background, Status, Essay, Consideration, Detail, HumanStudies, Progress, Civilization"
Film & History,"History, Film, Background, Essay, Detail, HumanStudies, Civilization"
Special Topics in History I,"History, SpecialTopics, Background, Status, Essay, Peace, Consideration, Detail, HumanStudies, Progress, Civilization"
Special Topics in History II,"History, SpecialTopics, Background, Status, Essay, Peace, Consideration, Detail, HumanStudies, Progress, Civilization"
Special Topics in History III,"History, SpecialTopics, Background, Status, Essay, Peace, Consideration, Detail, HumanStudies, Progress, Civilization"
Honors Seminar in Ethics,"Ethics, Honors, Seminar, Background, HumanStudies, Progress, Morals"
Honors First Year Seminar,"Honors, Seminar, FirstYear"
Honors Writing for College,"Honors, Writing"
F.D.R. Seminar,"FDR, Seminar, Honors, AmericanHistory, Presidency"
Capping Course,"SeniorYear, Capping, Honors"
Public History Internship,"History, Public, Internship, Letter, Evidence, Background, Chart, Principle, Progress, Status, Dream, Essay, Peace, Consideration, Detail, Interview"
Moral Foundations,"Moral, Honors, Seminar, Background, HumanStudies, Progress, Foundations"
Quantitative Analysis,"Honors, Quantitative, Analysis, Development, Math, ComputerScience"
Creativity,"Design, Creativity, Aesthetics, Art, Expression, Honors, Ideal"
Society,"Society, History, HumanStudies, Honors"
Honors-by-Contract,"Honors, Contract"
Honors Thesis Project,"Honors, Thesis, Project"
Honors Senior Seminar,"Honors, Seminar, SeniorYear"
Capping Experience,"Honors, SeniorYear, Capping, Experience"
Perspectives on Education,"Education, Perspectives, Experience"
Perspectives on the Humanities,"Perspectives, Humanities"
Internship in Professional Studies,"ProfessionalStudies, Internship"
Exploring Business & Management,"Business, BusinessManagement, BusinessAdministration, Operations, Money, Excel, CashFlows, Taxes, SupplyAndDemand, OperationChain"
Managing Organizations,"Business, BusinessManagement, Organizations, OperationChain"
Legal Issues in Organizations I,"Law, Legal, Issues, Organizations, Corporate, People, Regulations, People, Evidence"
Legal Issues in Organizations II,"Law, Legal, Issues, Organizations, Corporate, People, Regulations, People, Evidence"
Managing Human Resources,"Business, BusinessManagement, Organizations, Humans, HumanBehavior, HumanResources"
Behaviors in Organizations,"HumanBehavior, Organizations, Humans, HumanResources"
Issues in Leadership,"Issues, HumanBehavior, Management, Leadership"
Strategic Leadership & Innovation,"Leadership, Innovation, Leadership, HumanBehavior"
Leadership in the Global Workplace,"Leadership, Global, Workplace, HumanBehavior"
Foundations of Marketing,"Foundations, Marketing, Advertising, Research, Business, Sales, People"
Elementary Italian I,"Italian, Language, Elementary "
Elementary Italian II,"Italian, Language, Elementary"
Intermediate Italian I,"Italian, Language, Intermediate"
Intermediate Italian II,"Italian, Language, Intermediate"
Italian Literature,"Italian, Language, Literature, Character"
Advanced Italian I,"Italian, Language, Advanced"
Civilization of Italy,"Italy, Civilizations, Humans"
Italian Cinema,"Italian, Cinema, Film"
Capping Course,"Italian, Capping, SeniorYear"
Italian for Conversation,"Italian, Language, Conversation"
Advanced Reading and Composition,"Italian, Reading, Advanced, Composition"
Elementary Japanese I,"Japanese, Language, Elementary"
Elementary Japanese II,"Japanese, Language, Elementary"
Intermediate Japanese I,"Japanese, Language, Intermediate"
Intermediate Japanese II,"Japanese, Language, Intermediate"
The Civilization of Japan,"Japanese, Civilizations, Humans"
Elementary Latin I,"Latin, Language, Elementary"
Elementary Latin II,"Latin, Language, Elementary"
Intermediate Latin I,"Latin, Language, Intermediate"
Intermediate Latin II,"Latin, Language, Intermediate"
Self Development,"SelfDevelopment, Learning, Humans, HumanBehavior"
Critical Reading and Thinking,"CriticalReading, Thinking, Humans"
Precalculus,"Precalculus, Math, Logic, Reasoning"
Transfer Seminars,"Transfer, Seminars"
The College Experience,"College, Experience"
Introductory Statistics I,"Introductory, Statistics"
Intermediate Algebra,"Intermediate, Algebra, Math, Logic, Reasoning"
Introductory Statistics II,"Introductory, Statistics, Math, Logic, Reasoning"
Discrete Mathematics,"DiscreteMathematics, Logic, Reasoning"
Linear Algebra,"LinearAlgebra, Logic, Math, Reasoning"
Introduction to Data Analysis,"Introductory, DataAnalysis, Math, Logic, Reasoning"
Discrete Mathematics II,"DiscreteMathematics, Logic, Reasoning"
Differential Equations,"DifferentialEquations, Logic, Math, Reasoning"
Probability and Statistics,"Probability, Statistics, Logic, Math, Reasoning"
Operational Models,"OperationalModels, Math, Logic, Reasoning"
Applied Statistics,"AppliedStatistics, Math, Logic, Reasoning"
Calculus III,"Calculus, Math, Logic, Reasoning"
Calculus I,"Calculus, Math, Logic, Reasoning"
Special Topics in Mathematics I,"SpecialTopics, Mathematics"
Special Topics in Mathematics II,"SpecialTopics, Mathematics"
Calculus II,"Calculus, Math, Logic, Reasoning"
Math Practicum,"MathPracticum, Logic, Reasoning"
Applied Mathematics II,"AppliedMathematics, Logic, Reasoning"
Abstract Algebra I,"AbstractAlgebra, Logic, Reasoning, Math"
Complex Analysis,"ComplexAnalysis, Logic, Math, Reasoning"
Abstract Algebra II,"AbstractAlgebra, Logic, Reasoning, Math"
Computational Linear Algebra,"LinearAlgebra, Computational, Logic, Math, Reasoning"
Mathematical Analysis I,"MathematicalAnalysis, Logic, Reasoning"
Mathematical Analysis II,"MathematicalAnalysis, Logic, Reasoning"
Operations Research,"Operations, Research, SupplyAndDemand, OperationChain"
Numerical Analysis,"NumericalAnalysis, Math, Logic, Analysis"
Combinatorics,"Combinatorics, Math, Counting, FiniteStructures"
Fundamental Concepts of Geometry,"Geometry, FundamentalConcepts, Math, Logic, Reasoning"
Applied Mathematics I,"AppliedMathematics, Logic, Reasoning"
Elementary Topology,"ElementaryTopology, Math, Logic, Reasoning"
Foundations of Mathematics,"Fundamentals, Math, Logic, Reasoning"
Art of Film,"Art, Film, Culture"
Writing for Media,"Writing, Media, Culture, Language, English"
Video Production,"Video, Production, Film, Art, Editing, Culture"
Capping Course,"Capping, SeniorYear"
Introduction to Media Studies,"Introductory, MediaStudies, Film, Art, Culture"
Digital Toolbox,"Digital, Toolbox, Editing, Film, Art, Aesthetics, Ideal"
Introduction to Design,"Introductory, Design, Film, Art, Culture"
Acting I,"Acting, Film, Media, Culture"
Interactive Media I,"Interactive, MediaStudies, Film, Art, Culture"
Editing,"Film, Media, Editing, Art, Aesthetics, Ideal"
Audio Production,"Production, Audio, Editing, Film, Art"
Online Culture,"Online, Culture, SocialMedia"
Storytelling Across Media,"Media, Storytelling, Art, Aesthetics"
Lighting and Cinematography,"Media, Storytelling, Art, Aesthetics, Ideal, Ideal"
Media Performance,"Media, Performance, Art, Film, Aesthetics, Ideal"
Game Design I,"GameDesign, Aesthetics, Art, Gaming, Ideal"
Ethics and Gaming,"Ethics, Gaming, Morals, Humans, HumanBehavior"
Interactive Media II,"Interactive, MediaStudies, Film, Art, Culture"
History of Electronic Media,"History, ElectronicMedia, Film, Gaming, Technology, HumanBehavior"
Media Theory and Methods,"Media, Theory, Methods, Culture, Society, Reasoning"
Television Theory and Criticism,"Television, Theory, Criticism, Film, Media"
Race and Ethnicity in Film,"Race, Ethnicity, Film, Media, Art, Culture, Identity, Representation"
Current Issues in Television,"CurrentIssues, Television, Reasoning"
Film Theory and Criticism,"Theory, Film, Criticism, Art, Media"
Film and History,"History, Film, Art, Media, Aesthetics, Ideal"
Experimental Film and Video,"Experimental, Film, Video, Aesthetics, Media, Art, Ideal"
Documentary Film,"Documentary, Film, Video, Aesthetics, Media, Art, Ideal"
Current Issues in Film,"Issues, Current, Film, Society, Video, Aesthetics, Media, Art, Ideal"
Gender and Media,"Media, Gender, Sex, Social"
Film and Literature,"Film, Literature, Storytelling, Media, Aesthetics, Character, Ideal"
Directing,"Directing, Film, Storytelling, Art"
Digital Filmmaking,"Digital, FilmMaking, Film, Art, Storytelling"
Media Internship,"Media, Internship"
Game Design II,"GameDesign, Aesthetics, Art, Gaming, Ideal"
Advanced ScreenWriting,"ScreenWriting, Advanced, Film, Media, Art"
Advanced Post Production,"Advanced, PostProduction, Film, Art, Editing, Media"
Multi-Camera Production,"MultiCamera, Production, Film, Art, Aesthetics, Media, Ideal"
Topics in Interactive Media,"Topics, Interactive, Media, Film, Art, Aesthetics, Ideal"
Topics in Television,"Topics, Television, Film, Media, Art, Aesthetics, Ideal"
Topics in Global Cinema,"Topics, Cinema, Global, Film, Media, Art, Aesthetics, Ideal"
Advanced Media Internship,"Advanced, Media, Internship, Film, Art"
Media Studies Capping,"Media, Studies, Capping, Film, Art"
Hematology I,"Medicine, Cause, Prognosis, Treatment, DiseasePrevention, Blood"
Methods In Medical Technology,"Methods, Medical, Technology, Science"
Clinical Microbiology I,"Clinical, Microbiology, Medical, Science"
Clinical Chemistry I,"Clinical, Chemistry, Medical, Science"
Clinical Microscopy I,"Clinical, Microscopy, Medical, Science"
Clinical Microbiology II,"Clinical, Microbiology, Medical, Science"
Clinical Chemistry II,"Clinical, Chemistry, Medical, Science"
Hematology II,"Medicine, Cause, Prognosis, Treatment, DiseasePrevention, Blood"
Clinical Microscopy II,"Clinical, Microscopy, Medical, Science"
Topics in Medical Technology,"Topics, Medical, Technology, Science"
Intermediate Vocal Skills II,"Intermediate, Vocals, Skills, Music, Singing "
Independent Vocal Study,"Independent, Vocals, Skills, Music, Singing, Study"
Choral Singing I,"Choral, SingingVocals, Skills, Music "
Choral Singing II,"Choral, SingingVocals, Skills, Music "
Beginning Vocal Skills I,"Beginning, VocalSkills, Singing, Music"
Beginning Vocal Skills II,"Beginning, VocalSkills, Singing, Music"
Intermediate Vocal Skills I,"Intermediate, VocalSkills, Singing, Music"
Choral Singing III,"Choral, SingingVocals, Skills, Music "
Choral Singing IV,"Choral, SingingVocals, Skills, Music "
Marist College Singers Men,"Singers, Men, Music"
Marist College Singers Women,"Singers, Women, Music"
Beginning Instrumental Skills II,"Beginning, Instrumental, Skills, Music"
Intermediate Instrumental Skills I,"Intermediate, Instrumental, Skills, Music"
Marist College Chapel Choir,"Chapel, Choir, Music, Singing"
Independent Instrumental Study,"Independent, Instrumental, Study, Music"
Marist College Gospel Choir,"Gospel, Choir, Music, Singing"
Marist College Chamber Singers,"Chamber, Singers, Music, Singing"
Brass Ensemble,"Brass, Ensemble, Music"
Beginning Instrumental Skills I,"Beginning, Instrumental, Skills, Music"
Flute Choir,"Flute, Choir, Music, Instrumental, Skills"
Beginning Piano I,"Beginning, Piano, Music, Instrumental, Skills"
Woodwind Ensemble,"Woodwind, Ensemble, Music, Instrumental, Skills"
Orchestra,"Orchestra, Ensemble, Music, Instrumental, Skills"
Handbell Choir,"Handbell, Choir, Music, Ensemble, Instrumental, Skills"
Symphonic Band and Wind Symphony,"Percussion, Ensemble, Music, Instrumental, Skills"
Wind Symphony,"Symphonic, Wind, Ensemble, Instrumental, Music, Skills"
Guitar Ensemble,"Guitar, Ensemble, Music, Instrumental, Skills"
Percussion Ensemble,"Percussion, Ensemble, Music, Instrumental, Skills"
Beginning Piano II,"Beginning, Piano, Music, Instrumental, Skills"
Advanced Piano,"Advanced, Piano, Music, Instrumental, Skills"
Sight Reading,"SightReading, Music, Skills, Theory"
Theory of Music I,"Theory, Music, Skills "
Theory of Music II,"Theory, Music, Skills"
Introduction to Music,"Introduction, Music, Skills, Art"
Jazz and Sound,"Jazz, Sounds, Music, Art, Theory"
Baroque Masters,"Baroque, Masters, Music, Theory, Skills"
Music Cultures of the World,"Music, Culture, World, Global"
Popular Music in America,"Popular, Music, America, Culture, Genre"
History of the Music Industry,"History, Music, MusicIndustry"
History of Motion Picture Music,"History, MotionPicture, Music"
Beethoven and Schubert,"Beethoven, Schubert, Music, Theory, Skills"
Opera,"Opera, Music, Classical, Skills, Singing"
Music in America,"Music, America, AmericanHistory, Culture, Society"
Medieval and Renaissance Music,"Medieval, Renaissance, Music, History, Culture"
Special Topics in Music I,"SpecialTopics, Music"
Special Topics in Music II,"SpecialTopics, Music"
Special Topics in Music III,"SpecialTopics, Music"
Introduction to Law,"Introductory, Law, Justice, Society, Rules, Regulations, Evidence"
Real Property and Title Search,"RealProperty, TitleSearch, Rules, Regulationss, Evidence"
Juvenile Law and Procedures,"JuvenileLaw, Law, Procedures, Rules, Regulationss, Evidence"
Criminal Law,"Criminal, Law, Procedures, Regulationss, Rules, Evidence"
Administrative Law,"Wills, Trusts, Estates, Law, Procedures, Regulations, Rules"
Business Law II,"BusinessLaw, Law, Procedures, Regulationss, Rules"
Business Law I,"BusinessLaw, Law, Procedures, Regulationss, Rules"
"Wills, Trusts, Estates","Wills, Trusts, Estates, Law, Procedures, Regulationss, Rules"
Family Law,"FamilyLaw, Law, Procedures, Regulationss, Rules, Evidence"
Corporate Law,"CorporateLaw, Law, Procedures, Regulationss, Rules, Evidence"
Law and Society,"Law, Society, Procedures, Regulationss, Rules, Evidence"
Civil Litigation and Practice,"civilLitigation, Practice, Procedures, Regulationss, Rules, Evidence"
Introduction to Logic,"Introductory, Logic, CriticalThinking"
Labor Relations Law,"LaborRelations, Law, Procedures, Regulationss, Rules, Evidence"
Ancient Philosophy,"Ancient, Philosophy, History, International "
Philosophical Perspectives,"Philosophical, Perspectives"
World Views and Values,"World, Views, Values, Global, Society"
Ethics,"Ethics, Morals, CriticalThinking, Theory, Society"
Modern Philosophy,"Modern, Philosophy, CriticalThinking"
Philosophy of Education,"Philosophy, Education, CriticalThinking"
Pragmatism,"Pragmatism, Philosophy, ProblemSolving, CriticalThinking"
Social and Political Philosophy,"Social, Political, Philosophy, Society"
Existentialism,"Existentialism, Philosophy, FreeWill "
Environmental Ethics,"Environmental, Ethics, Morals, Society"
Philosophy and Technology,"Philosophy, Technology, Logic, Society, CriticalThinking"
Aesthetics,"Aesthetics, Preferences, BeautyPrinciples, ArtisticTaste, Ideal"
Symbolic Logic,"SymbolicLogic, Logic, Theory, Reasoning"
Medieval Philosophy,"Medieval, Philosophy, CriticalThinking "
Philosophy of History,"Philosophy, History, Society"
Contemporary Analytic Philosophy,"Contemporary, Analytic, philosophy"
Philosophy of Religion,"Philosophy, Religion, criticalHistory"
Philosophy and Film,"Philosophy, Film, Movies, Art, CriticalThinking"
MetaPhysics: The Nature of Reality,"MetaPhysics, Nature, Reality, Consciousness, "
Marx and Marxism,"Marx, Philosophy, Communism, Economic, Political, Social"
Philosophy of Mind,"Philosophy, Mind, Humans"
Capping Course,"Capping, SeniorYear"
Volleyball,"Volleyball, PhysicalEducation, Team, Sports"
Golf,"Golf, PhysicalEducation, Team, Sports"
Archery,"Archery, PhysicalEducation, Team, Sports"
Conditioning,"Conditioning, PhysicalEducation"
Tennis,"Tennis, PhysicalEducation, Team, Sports"
Modern Dance I,"Modern, Dance, PhysicalEducation, Team, Sports"
Modern Dance II,"Modern, Dance, PhysicalEducation, Team, Sports"
Boxing,"Boxing, PhysicalEducation, Team, Sports"
Physiology of Health,"Physiology, Health, Study, HumanBody"
Racquetball,"Racquetball, PhysicalEducation, Team, Sports"
Beginning Classical Ballet,"Beginning, Classical, Ballet, PhysicalEducation"
Fencing,"Fencing, PhysicalEducation, Team, Sports"
Sailing,"Sailing, PhysicalEducation, Team, Sports"
Sports in Society,"Sports, Society, PhysicalEducation"
Beginning Swimming (Non-Swimmers),"Beginning, Swimming, PhysicalEducation, Sports"
Soccer Coaching,"Soccer, Coaching, PhysicalEducation, Sports"
Karate I,"Karate, PhysicalEducation, Sports"
Yoga,"Yoga, PhysicalEducation"
Basketball Coaching,"Basketball, Coaching, PhysicalEducation, Sports"
Springboard Diving,"Springboard, Diving, PhysicalEducation, Sports"
Baseball Coaching,"Baseball, Coaching, PhysicalEducation, Sports"
Fly Fishing,"FlyFishing, PhysicalEducation, Sports"
Football Coaching,"Football, Coaching, PhysicalEducation, Sports"
Scuba Diving,"ScubaDiving, PhysicalEducation, Sports"
Movement in Sports,"Movement, Sports, PhysicalEducation"
Modern Physics,"Modern, Physics, Science, Logic, Reasoning"
Introduction to Cosmology,"Introductory, Cosmology, Science"
Physics of Modern Technology,"Physics, Modern, Technology, Science"
College Physics I,"College, PhysicsScience"
College Physics II,"College, PhysicsScience"
General Physics I,"General, PhysicsScience"
General Physics II,"General, PhysicsScience"
American National Government,"American, National, Government, AmericanHistory, Policy"
Introduction to Political Theory,"Introductory, Political, Theory, CrticialThinking, PoliticalScience"
International Relations,"International, Relations, Cultures, Society, Security"
American State and Local Politics,"American, State, Local, Politics, Society, Campaign"
Polling and the Survey Instrument,"Polling, Survey, Instrument, Politics, Voting, Society, Campaign"
Survey Design and Data Collection,"Survey, Design, DataCollection, Politics, Society"
Polling and the Media,"Polling, Media, Politics, Society, Campaign"
Environmental Politics and Policy,"Environmental, Politics, Policy, Rules, Society, Campaign"
Politics of Human Rights,"Politics, Human, Rights, Society, Campaign"
Gender and the Law,"Gender, Sex, Law, Rules, Procedures"
Modern Political Thought,"Modern, PoliticalThought, Society, CriticalThinking"
Catholics in the U.S.,"Catholics, US, America, AmericanHistory, Religion"
American Political Thought,"American, Politics, AmericanHistory, CriticalThinking, Campaign"
Politics of Developing Areas,"Politics, DevelopingAreas, Humans, Campaign"
Introduction to Public Policy,"Introductory, PublicPolicy, Political, Theory, crticialThinking, PoliticalScience"
Classical Political Thought,"Classical, PublicPolicy, Political, Theory, crticialThinking, PoliticalScience"
European Politics,"European, Politics, Society, Campaign"
International Law and Organization,"International, Law, Organizations, Society"
Italian-American Experience,"ItalianAmerican, Experience, AmericanHistory"
Model United Nations,"ModelUnitedNations, International, Society, Politics"
Public Opinion and Politics,"PublicOpinions, Politics, Society, Campaign"
Political Social Movements,"Political, Social, Movements, HumanBehavior"
Politics of Prejudice,"Politics, Prejudice, Discrimination, Society, Campaign"
Public Administration,"Public, Administration, Policy, mangement, Processes, FinancialManagement"
Race and Political Thought,"Race, PoliticalThought, Society, Discrimination"
Policy Implementation,"Policy, implementation, Government, Goals, Objectives"
International Political Economy,"International, Political, Economy, Society, Government"
Feminist Political Thought,"Feminist, PoliticalThought, HumanBehavior, Politics, Society, Campaign"
Contemporary Political Theory,"Contemporary, Political, Theory, Society"
Latin American Politics,"LatinAmerican, Politics, Policy, History, Government, Campaign"
African Politics,"AfricanPolitics, Policy, History, Government, Campaign"
Environmental Planning,"EnvironmentalPlanning, Politics, Policy, Society"
Congress Today,"CongressToday, Modern, Government, Society"
Capping: Law and Morality,"Capping, SeniorYear, Law, Morality"
Introduction to Psychology,"Introductory, Psychology, HumanBehavior, CriticalThinking"
Psychology Seminar,"Psychology, seminar, HumanBehavior, CriticalThinking"
Personality Development,"Personality, Development, HumanBehavior, Humans"
Theories of Personality,"Theories, Personality, Development, HumanBehavior, Humans"
Social Psychology,"Social, Psychology, Situations, SocialEnvironments, Behaviors, HumanBehavior "
Abnormal Psychology,"Abnormal, Psychology, UnusualPatterns, Emotion, Thought, HumanBehavior"
Psycho-Biological Sex Differences,"Sex, Differences, PsychoBiological, HumanBehavior, Physical"
Community Psychology,"Community, Psychology, Humans, HumanBehavior, Society, Groups, Organizations, Institutions"
The Exceptional Child,"ExceptionalChild, Psychology, Humans, HumanBehavior"
Educational Psychology,"Educational, Psychology, Society, HumanBehavior"
The Psychology of Sleep,"SleepPsychology, HumanBehavior, CriticalThinking"
"EnvironmentalPlanning, Politics, Policy, Society","PsychoBiology, Lab, CriticalThinking, Science, HumanBehavior"
Psychopharmacology and Lab,"CriticalReading, Thinking, Humans"
Ethics and Professional Issues,"Ethics, ProfessionalIssues, Morals"
Human FActors Psychology,"HumanFactors, Psychology, Science, HumanBehavior"
Child Development,"Children, Development, Humans, HumanBehavior, Science"
Psychology of the Adolescent,"Psychology, Adolescence, Children, Humans, HumanBehavior"
Adult Development,"Adult, Development, Humans, HumanBehavior, Science"
Lifespan Development,"Lifespan, Development, Humans, HumanBehavior, Science"
Culture and Psychology,"Culture, Psychology, Society, Humans, HumanBehavior"
Psychology of Women,"Psychology, Women, Sex, HumanBehavior, Humans, CriticalThinking, Society "
Fundamentals of Counseling,"Fundamentals, Counseling, Humans, HumanBehavior"
Measurement and Evaluation,"Measurement, Evaluation, Comparison, Learning, Humans"
Cognitive Psychology,"Cognitive, Psychology, Internal, MentalProcesses, ProblemSolving, Perception "
Special Topics in Psychology I,"SpecialTopics, Psychology, HumanBehavior"
Special Topics in Psychology II,"SpecialTopics, Psychology, HumanBehavior"
Psychological Research Methods III,"SpecialTopics, Psychology, Research, Methods, HumanBehavior"
Educational Psychology Seminar,"Educational, Psychology, Seminar, Society, HumanBehavior"
Contemporary Religious Education,"Contemporary, Religious, Education, Principles, Faith, Modern"
Judaism,"Judaism, Religious, Educational, Faith"
World Religions,"WorldReligions, Religious, Educational, Faith, Global"
Supervised Research,"SupervisedResearch, WrittenAnalysis, LegalIssue"
Introduction to Religion,"Introductory, Religious, ReligiousStudies, Spirituality"
Religion in America,"Religion, America, ReligiousStudies, AmericanStudies"
Christianity,"Christianity, ReligiousStudies, Faith"
Film and the Bible,"Film, Bible, Religion, Faith, Spirituality, Art"
Religious Themes in Literature,"Religious, Themes, Literature, Spirituality, Faith, Writing, Art, Character"
Stories of India,"Stories, India, Cultural, History, Art, Literature, Character"
Ancient Greek Religion,"Ancient, Greek, Religion, Pantheon, Stories, Mythology"
Catholics in the U.S.,"Catholics, US, AmericanHistory, Religion, Faith, Spirituality"
Sociology of Religion,"Sociology, Religion, HumanBehavior, Faith"
Jesus and Discipleship,"Jesus, Discipleship, Faith, Religion, Christianity"
Social Ethics and Economics,"SocialEthics, Economics, Morals, Society, HumanBehavior"
Judeo-Christian Scriptures,"JudaeoChristian, Scriptures, Literature, Christianity, Religion, Character"
Religion and Politics,"Religion, Politics, Church, State, Faith, Society, Government"
Religion and Culture,"Religion, Culture, Society, Faith, Spirituality, Community"
